10-44 spi: mosi-data: "00"
46-80 spi: mosi-data: "01"
83-118 spi: mosi-data: "02"
119-153 spi: mosi-data: "03"
155-189 spi: mosi-data: "04"
192-227 spi: mosi-data: "05"
228-262 spi: mosi-data: "06"
265-298 spi: mosi-data: "07"
301-335 spi: mosi-data: "08"
337-371 spi: mosi-data: "09"
374-407 spi: mosi-data: "0A"
410-444 spi: mosi-data: "0B"
446-480 spi: mosi-data: "0C"
483-518 spi: mosi-data: "0D"
519-553 spi: mosi-data: "0E"
555-589 spi: mosi-data: "0F"
592-627 spi: mosi-data: "10"
628-662 spi: mosi-data: "11"
664-698 spi: mosi-data: "12"
701-736 spi: mosi-data: "13"
737-771 spi: mosi-data: "14"
774-807 spi: mosi-data: "15"
810-844 spi: mosi-data: "16"
846-880 spi: mosi-data: "17"
883-918 spi: mosi-data: "18"
919-953 spi: mosi-data: "19"
955-989 spi: mosi-data: "1A"
992-1027 spi: mosi-data: "1B"
1028-1062 spi: mosi-data: "1C"
1064-1098 spi: mosi-data: "1D"
1101-1136 spi: mosi-data: "1E"
1137-1171 spi: mosi-data: "1F"
1174-1207 spi: mosi-data: "20"
1210-1244 spi: mosi-data: "21"
1246-1280 spi: mosi-data: "22"
1283-1318 spi: mosi-data: "23"
1319-1353 spi: mosi-data: "24"
1355-1389 spi: mosi-data: "25"
1392-1427 spi: mosi-data: "26"
1428-1462 spi: mosi-data: "27"
1464-1498 spi: mosi-data: "28"
1501-1536 spi: mosi-data: "29"
1537-1571 spi: mosi-data: "2A"
1574-1607 spi: mosi-data: "2B"
1610-1645 spi: mosi-data: "2C"
1646-1680 spi: mosi-data: "2D"
1683-1716 spi: mosi-data: "2E"
1719-1753 spi: mosi-data: "2F"
1755-1789 spi: mosi-data: "30"
1792-1827 spi: mosi-data: "31"
1828-1862 spi: mosi-data: "32"
1864-1898 spi: mosi-data: "33"
1901-1936 spi: mosi-data: "34"
1937-1971 spi: mosi-data: "35"
1973-2007 spi: mosi-data: "36"
2010-2045 spi: mosi-data: "37"
2046-2080 spi: mosi-data: "38"
2083-2116 spi: mosi-data: "39"
2119-2153 spi: mosi-data: "3A"
2155-2189 spi: mosi-data: "3B"
2192-2227 spi: mosi-data: "3C"
2228-2262 spi: mosi-data: "3D"
2264-2298 spi: mosi-data: "3E"
2301-2336 spi: mosi-data: "3F"
2337-2371 spi: mosi-data: "40"
2373-2407 spi: mosi-data: "41"
2410-2445 spi: mosi-data: "42"
2446-2480 spi: mosi-data: "43"
2483-2516 spi: mosi-data: "44"
2519-2554 spi: mosi-data: "45"
2555-2589 spi: mosi-data: "46"
2592-2625 spi: mosi-data: "47"
2628-2662 spi: mosi-data: "48"
2664-2698 spi: mosi-data: "49"
2701-2736 spi: mosi-data: "4A"
2737-2771 spi: mosi-data: "4B"
2773-2807 spi: mosi-data: "4C"
2810-2845 spi: mosi-data: "4D"
2846-2880 spi: mosi-data: "4E"
2882-2916 spi: mosi-data: "4F"
2919-2954 spi: mosi-data: "50"
2955-2989 spi: mosi-data: "51"
2992-3025 spi: mosi-data: "52"
3028-3062 spi: mosi-data: "53"
3064-3098 spi: mosi-data: "54"
3101-3134 spi: mosi-data: "55"
3137-3171 spi: mosi-data: "56"
3173-3207 spi: mosi-data: "57"
3210-3245 spi: mosi-data: "58"
3246-3280 spi: mosi-data: "59"
3282-3316 spi: mosi-data: "5A"
3319-3354 spi: mosi-data: "5B"
3355-3389 spi: mosi-data: "5C"
3391-3425 spi: mosi-data: "5D"
3428-3463 spi: mosi-data: "5E"
3464-3498 spi: mosi-data: "5F"
3501-3534 spi: mosi-data: "60"
3537-3571 spi: mosi-data: "61"
3573-3607 spi: mosi-data: "62"
3610-3645 spi: mosi-data: "63"
3646-3680 spi: mosi-data: "64"
3682-3716 spi: mosi-data: "65"
3719-3754 spi: mosi-data: "66"
3755-3789 spi: mosi-data: "67"
3791-3825 spi: mosi-data: "68"
3828-3863 spi: mosi-data: "69"
3864-3898 spi: mosi-data: "6A"
3901-3934 spi: mosi-data: "6B"
3937-3971 spi: mosi-data: "6C"
3973-4007 spi: mosi-data: "6D"
4010-4045 spi: mosi-data: "6E"
4046-4080 spi: mosi-data: "6F"
4082-4116 spi: mosi-data: "70"
4119-4154 spi: mosi-data: "71"
4155-4189 spi: mosi-data: "72"
4191-4225 spi: mosi-data: "73"
4228-4263 spi: mosi-data: "74"
4264-4298 spi: mosi-data: "75"
4301-4334 spi: mosi-data: "76"
4337-4372 spi: mosi-data: "77"
4373-4407 spi: mosi-data: "78"
4410-4443 spi: mosi-data: "79"
4446-4480 spi: mosi-data: "7A"
4482-4516 spi: mosi-data: "7B"
4519-4554 spi: mosi-data: "7C"
4555-4589 spi: mosi-data: "7D"
4591-4625 spi: mosi-data: "7E"
4628-4663 spi: mosi-data: "7F"
4664-4698 spi: mosi-data: "80"
4700-4734 spi: mosi-data: "81"
4737-4772 spi: mosi-data: "82"
4773-4807 spi: mosi-data: "83"
4810-4843 spi: mosi-data: "84"
4846-4880 spi: mosi-data: "85"
4882-4916 spi: mosi-data: "86"
4919-4954 spi: mosi-data: "87"
4955-4989 spi: mosi-data: "88"
4991-5025 spi: mosi-data: "89"
5028-5063 spi: mosi-data: "8A"
5064-5098 spi: mosi-data: "8B"
5100-5134 spi: mosi-data: "8C"
5137-5172 spi: mosi-data: "8D"
5173-5207 spi: mosi-data: "8E"
5210-5243 spi: mosi-data: "8F"
5246-5280 spi: mosi-data: "90"
5282-5316 spi: mosi-data: "91"
5319-5352 spi: mosi-data: "92"
5355-5389 spi: mosi-data: "93"
5391-5425 spi: mosi-data: "94"
5428-5463 spi: mosi-data: "95"
5464-5498 spi: mosi-data: "96"
5500-5534 spi: mosi-data: "97"
5537-5572 spi: mosi-data: "98"
5573-5607 spi: mosi-data: "99"
5610-5643 spi: mosi-data: "9A"
5646-5681 spi: mosi-data: "9B"
5682-5716 spi: mosi-data: "9C"
5719-5752 spi: mosi-data: "9D"
5755-5789 spi: mosi-data: "9E"
5791-5825 spi: mosi-data: "9F"
5828-5863 spi: mosi-data: "A0"
5864-5898 spi: mosi-data: "A1"
5900-5934 spi: mosi-data: "A2"
5937-5972 spi: mosi-data: "A3"
5973-6007 spi: mosi-data: "A4"
6009-6043 spi: mosi-data: "A5"
6046-6081 spi: mosi-data: "A6"
6082-6116 spi: mosi-data: "A7"
6119-6152 spi: mosi-data: "A8"
6155-6189 spi: mosi-data: "A9"
6191-6225 spi: mosi-data: "AA"
6228-6263 spi: mosi-data: "AB"
6264-6298 spi: mosi-data: "AC"
6300-6334 spi: mosi-data: "AD"
6337-6372 spi: mosi-data: "AE"
6373-6407 spi: mosi-data: "AF"
6409-6443 spi: mosi-data: "B0"
6446-6481 spi: mosi-data: "B1"
6482-6516 spi: mosi-data: "B2"
6519-6552 spi: mosi-data: "B3"
6555-6590 spi: mosi-data: "B4"
6591-6625 spi: mosi-data: "B5"
6628-6661 spi: mosi-data: "B6"
6664-6698 spi: mosi-data: "B7"
6700-6734 spi: mosi-data: "B8"
6737-6772 spi: mosi-data: "B9"
6773-6807 spi: mosi-data: "BA"
6809-6843 spi: mosi-data: "BB"
6846-6881 spi: mosi-data: "BC"
6882-6916 spi: mosi-data: "BD"
6918-6952 spi: mosi-data: "BE"
6955-6990 spi: mosi-data: "BF"
6991-7025 spi: mosi-data: "C0"
7028-7061 spi: mosi-data: "C1"
7064-7098 spi: mosi-data: "C2"
7100-7134 spi: mosi-data: "C3"
7137-7172 spi: mosi-data: "C4"
7173-7207 spi: mosi-data: "C5"
7209-7243 spi: mosi-data: "C6"
7246-7281 spi: mosi-data: "C7"
7282-7316 spi: mosi-data: "C8"
7318-7352 spi: mosi-data: "C9"
7355-7390 spi: mosi-data: "CA"
7391-7425 spi: mosi-data: "CB"
7428-7461 spi: mosi-data: "CC"
7464-7499 spi: mosi-data: "CD"
7500-7534 spi: mosi-data: "CE"
7537-7570 spi: mosi-data: "CF"
7573-7607 spi: mosi-data: "D0"
7609-7643 spi: mosi-data: "D1"
7646-7681 spi: mosi-data: "D2"
7682-7716 spi: mosi-data: "D3"
7718-7752 spi: mosi-data: "D4"
7755-7790 spi: mosi-data: "D5"
7791-7825 spi: mosi-data: "D6"
7827-7861 spi: mosi-data: "D7"
7864-7899 spi: mosi-data: "D8"
7900-7934 spi: mosi-data: "D9"
7937-7970 spi: mosi-data: "DA"
7973-8007 spi: mosi-data: "DB"
8009-8043 spi: mosi-data: "DC"
8046-8081 spi: mosi-data: "DD"
8082-8116 spi: mosi-data: "DE"
8118-8152 spi: mosi-data: "DF"
8155-8190 spi: mosi-data: "E0"
8191-8225 spi: mosi-data: "E1"
8227-8261 spi: mosi-data: "E2"
8264-8299 spi: mosi-data: "E3"
8300-8334 spi: mosi-data: "E4"
8337-8370 spi: mosi-data: "E5"
8373-8408 spi: mosi-data: "E6"
8409-8443 spi: mosi-data: "E7"
8446-8479 spi: mosi-data: "E8"
8482-8516 spi: mosi-data: "E9"
8518-8552 spi: mosi-data: "EA"
8555-8590 spi: mosi-data: "EB"
8591-8625 spi: mosi-data: "EC"
8627-8661 spi: mosi-data: "ED"
8664-8699 spi: mosi-data: "EE"
8700-8734 spi: mosi-data: "EF"
8736-8770 spi: mosi-data: "F0"
8773-8808 spi: mosi-data: "F1"
8809-8843 spi: mosi-data: "F2"
8846-8879 spi: mosi-data: "F3"
8882-8916 spi: mosi-data: "F4"
8918-8952 spi: mosi-data: "F5"
8955-8990 spi: mosi-data: "F6"
8991-9025 spi: mosi-data: "F7"
9027-9061 spi: mosi-data: "F8"
9064-9099 spi: mosi-data: "F9"
9100-9134 spi: mosi-data: "FA"
9136-9170 spi: mosi-data: "FB"
9173-9208 spi: mosi-data: "FC"
9209-9243 spi: mosi-data: "FD"
9246-9279 spi: mosi-data: "FE"
9282-9316 spi: mosi-data: "FF"
