10-44 spi: miso-data: "00"
46-80 spi: miso-data: "01"
83-118 spi: miso-data: "02"
119-153 spi: miso-data: "03"
155-189 spi: miso-data: "04"
192-227 spi: miso-data: "05"
228-262 spi: miso-data: "06"
265-298 spi: miso-data: "07"
301-335 spi: miso-data: "08"
337-371 spi: miso-data: "09"
374-407 spi: miso-data: "0A"
410-444 spi: miso-data: "0B"
446-480 spi: miso-data: "0C"
483-518 spi: miso-data: "0D"
519-553 spi: miso-data: "0E"
555-589 spi: miso-data: "0F"
592-627 spi: miso-data: "10"
628-662 spi: miso-data: "11"
664-698 spi: miso-data: "12"
701-736 spi: miso-data: "13"
737-771 spi: miso-data: "14"
774-807 spi: miso-data: "15"
810-844 spi: miso-data: "16"
846-880 spi: miso-data: "17"
883-918 spi: miso-data: "18"
919-953 spi: miso-data: "19"
955-989 spi: miso-data: "1A"
992-1027 spi: miso-data: "1B"
1028-1062 spi: miso-data: "1C"
1064-1098 spi: miso-data: "1D"
1101-1136 spi: miso-data: "1E"
1137-1171 spi: miso-data: "1F"
1174-1207 spi: miso-data: "20"
1210-1244 spi: miso-data: "21"
1246-1280 spi: miso-data: "22"
1283-1318 spi: miso-data: "23"
1319-1353 spi: miso-data: "24"
1355-1389 spi: miso-data: "25"
1392-1427 spi: miso-data: "26"
1428-1462 spi: miso-data: "27"
1464-1498 spi: miso-data: "28"
1501-1536 spi: miso-data: "29"
1537-1571 spi: miso-data: "2A"
1574-1607 spi: miso-data: "2B"
1610-1645 spi: miso-data: "2C"
1646-1680 spi: miso-data: "2D"
1683-1716 spi: miso-data: "2E"
1719-1753 spi: miso-data: "2F"
1755-1789 spi: miso-data: "30"
1792-1827 spi: miso-data: "31"
1828-1862 spi: miso-data: "32"
1864-1898 spi: miso-data: "33"
1901-1936 spi: miso-data: "34"
1937-1971 spi: miso-data: "35"
1973-2007 spi: miso-data: "36"
2010-2045 spi: miso-data: "37"
2046-2080 spi: miso-data: "38"
2083-2116 spi: miso-data: "39"
2119-2153 spi: miso-data: "3A"
2155-2189 spi: miso-data: "3B"
2192-2227 spi: miso-data: "3C"
2228-2262 spi: miso-data: "3D"
2264-2298 spi: miso-data: "3E"
2301-2336 spi: miso-data: "3F"
2337-2371 spi: miso-data: "40"
2373-2407 spi: miso-data: "41"
2410-2445 spi: miso-data: "42"
2446-2480 spi: miso-data: "43"
2483-2516 spi: miso-data: "44"
2519-2554 spi: miso-data: "45"
2555-2589 spi: miso-data: "46"
2592-2625 spi: miso-data: "47"
2628-2662 spi: miso-data: "48"
2664-2698 spi: miso-data: "49"
2701-2736 spi: miso-data: "4A"
2737-2771 spi: miso-data: "4B"
2773-2807 spi: miso-data: "4C"
2810-2845 spi: miso-data: "4D"
2846-2880 spi: miso-data: "4E"
2882-2916 spi: miso-data: "4F"
2919-2954 spi: miso-data: "50"
2955-2989 spi: miso-data: "51"
2992-3025 spi: miso-data: "52"
3028-3062 spi: miso-data: "53"
3064-3098 spi: miso-data: "54"
3101-3134 spi: miso-data: "55"
3137-3171 spi: miso-data: "56"
3173-3207 spi: miso-data: "57"
3210-3245 spi: miso-data: "58"
3246-3280 spi: miso-data: "59"
3282-3316 spi: miso-data: "5A"
3319-3354 spi: miso-data: "5B"
3355-3389 spi: miso-data: "5C"
3391-3425 spi: miso-data: "5D"
3428-3463 spi: miso-data: "5E"
3464-3498 spi: miso-data: "5F"
3501-3534 spi: miso-data: "60"
3537-3571 spi: miso-data: "61"
3573-3607 spi: miso-data: "62"
3610-3645 spi: miso-data: "63"
3646-3680 spi: miso-data: "64"
3682-3716 spi: miso-data: "65"
3719-3754 spi: miso-data: "66"
3755-3789 spi: miso-data: "67"
3791-3825 spi: miso-data: "68"
3828-3863 spi: miso-data: "69"
3864-3898 spi: miso-data: "6A"
3901-3934 spi: miso-data: "6B"
3937-3971 spi: miso-data: "6C"
3973-4007 spi: miso-data: "6D"
4010-4045 spi: miso-data: "6E"
4046-4080 spi: miso-data: "6F"
4082-4116 spi: miso-data: "70"
4119-4154 spi: miso-data: "71"
4155-4189 spi: miso-data: "72"
4191-4225 spi: miso-data: "73"
4228-4263 spi: miso-data: "74"
4264-4298 spi: miso-data: "75"
4301-4334 spi: miso-data: "76"
4337-4372 spi: miso-data: "77"
4373-4407 spi: miso-data: "78"
4410-4443 spi: miso-data: "79"
4446-4480 spi: miso-data: "7A"
4482-4516 spi: miso-data: "7B"
4519-4554 spi: miso-data: "7C"
4555-4589 spi: miso-data: "7D"
4591-4625 spi: miso-data: "7E"
4628-4663 spi: miso-data: "7F"
4664-4698 spi: miso-data: "80"
4700-4734 spi: miso-data: "81"
4737-4772 spi: miso-data: "82"
4773-4807 spi: miso-data: "83"
4810-4843 spi: miso-data: "84"
4846-4880 spi: miso-data: "85"
4882-4916 spi: miso-data: "86"
4919-4954 spi: miso-data: "87"
4955-4989 spi: miso-data: "88"
4991-5025 spi: miso-data: "89"
5028-5063 spi: miso-data: "8A"
5064-5098 spi: miso-data: "8B"
5100-5134 spi: miso-data: "8C"
5137-5172 spi: miso-data: "8D"
5173-5207 spi: miso-data: "8E"
5210-5243 spi: miso-data: "8F"
5246-5280 spi: miso-data: "90"
5282-5316 spi: miso-data: "91"
5319-5352 spi: miso-data: "92"
5355-5389 spi: miso-data: "93"
5391-5425 spi: miso-data: "94"
5428-5463 spi: miso-data: "95"
5464-5498 spi: miso-data: "96"
5500-5534 spi: miso-data: "97"
5537-5572 spi: miso-data: "98"
5573-5607 spi: miso-data: "99"
5610-5643 spi: miso-data: "9A"
5646-5681 spi: miso-data: "9B"
5682-5716 spi: miso-data: "9C"
5719-5752 spi: miso-data: "9D"
5755-5789 spi: miso-data: "9E"
5791-5825 spi: miso-data: "9F"
5828-5863 spi: miso-data: "A0"
5864-5898 spi: miso-data: "A1"
5900-5934 spi: miso-data: "A2"
5937-5972 spi: miso-data: "A3"
5973-6007 spi: miso-data: "A4"
6009-6043 spi: miso-data: "A5"
6046-6081 spi: miso-data: "A6"
6082-6116 spi: miso-data: "A7"
6119-6152 spi: miso-data: "A8"
6155-6189 spi: miso-data: "A9"
6191-6225 spi: miso-data: "AA"
6228-6263 spi: miso-data: "AB"
6264-6298 spi: miso-data: "AC"
6300-6334 spi: miso-data: "AD"
6337-6372 spi: miso-data: "AE"
6373-6407 spi: miso-data: "AF"
6409-6443 spi: miso-data: "B0"
6446-6481 spi: miso-data: "B1"
6482-6516 spi: miso-data: "B2"
6519-6552 spi: miso-data: "B3"
6555-6590 spi: miso-data: "B4"
6591-6625 spi: miso-data: "B5"
6628-6661 spi: miso-data: "B6"
6664-6698 spi: miso-data: "B7"
6700-6734 spi: miso-data: "B8"
6737-6772 spi: miso-data: "B9"
6773-6807 spi: miso-data: "BA"
6809-6843 spi: miso-data: "BB"
6846-6881 spi: miso-data: "BC"
6882-6916 spi: miso-data: "BD"
6918-6952 spi: miso-data: "BE"
6955-6990 spi: miso-data: "BF"
6991-7025 spi: miso-data: "C0"
7028-7061 spi: miso-data: "C1"
7064-7098 spi: miso-data: "C2"
7100-7134 spi: miso-data: "C3"
7137-7172 spi: miso-data: "C4"
7173-7207 spi: miso-data: "C5"
7209-7243 spi: miso-data: "C6"
7246-7281 spi: miso-data: "C7"
7282-7316 spi: miso-data: "C8"
7318-7352 spi: miso-data: "C9"
7355-7390 spi: miso-data: "CA"
7391-7425 spi: miso-data: "CB"
7428-7461 spi: miso-data: "CC"
7464-7499 spi: miso-data: "CD"
7500-7534 spi: miso-data: "CE"
7537-7570 spi: miso-data: "CF"
7573-7607 spi: miso-data: "D0"
7609-7643 spi: miso-data: "D1"
7646-7681 spi: miso-data: "D2"
7682-7716 spi: miso-data: "D3"
7718-7752 spi: miso-data: "D4"
7755-7790 spi: miso-data: "D5"
7791-7825 spi: miso-data: "D6"
7827-7861 spi: miso-data: "D7"
7864-7899 spi: miso-data: "D8"
7900-7934 spi: miso-data: "D9"
7937-7970 spi: miso-data: "DA"
7973-8007 spi: miso-data: "DB"
8009-8043 spi: miso-data: "DC"
8046-8081 spi: miso-data: "DD"
8082-8116 spi: miso-data: "DE"
8118-8152 spi: miso-data: "DF"
8155-8190 spi: miso-data: "E0"
8191-8225 spi: miso-data: "E1"
8227-8261 spi: miso-data: "E2"
8264-8299 spi: miso-data: "E3"
8300-8334 spi: miso-data: "E4"
8337-8370 spi: miso-data: "E5"
8373-8408 spi: miso-data: "E6"
8409-8443 spi: miso-data: "E7"
8446-8479 spi: miso-data: "E8"
8482-8516 spi: miso-data: "E9"
8518-8552 spi: miso-data: "EA"
8555-8590 spi: miso-data: "EB"
8591-8625 spi: miso-data: "EC"
8627-8661 spi: miso-data: "ED"
8664-8699 spi: miso-data: "EE"
8700-8734 spi: miso-data: "EF"
8736-8770 spi: miso-data: "F0"
8773-8808 spi: miso-data: "F1"
8809-8843 spi: miso-data: "F2"
8846-8879 spi: miso-data: "F3"
8882-8916 spi: miso-data: "F4"
8918-8952 spi: miso-data: "F5"
8955-8990 spi: miso-data: "F6"
8991-9025 spi: miso-data: "F7"
9027-9061 spi: miso-data: "F8"
9064-9099 spi: miso-data: "F9"
9100-9134 spi: miso-data: "FA"
9136-9170 spi: miso-data: "FB"
9173-9208 spi: miso-data: "FC"
9209-9243 spi: miso-data: "FD"
9246-9279 spi: miso-data: "FE"
9282-9316 spi: miso-data: "FF"
