13-81 uart: rx-data: "[B3]"
98-166 uart: rx-data: "[B3]"
183-251 uart: rx-data: "[B3]"
268-336 uart: rx-data: "[B3]"
353-421 uart: rx-data: "[B3]"
438-506 uart: rx-data: "[B3]"
523-591 uart: rx-data: "[B3]"
608-676 uart: rx-data: "[B3]"
693-761 uart: rx-data: "[B3]"
778-846 uart: rx-data: "[B3]"
863-931 uart: rx-data: "[B3]"
948-1016 uart: rx-data: "[B3]"
1033-1101 uart: rx-data: "[B3]"
1118-1186 uart: rx-data: "[B3]"
1203-1271 uart: rx-data: "[B3]"
1288-1356 uart: rx-data: "[B3]"
1373-1441 uart: rx-data: "[B3]"
1458-1526 uart: rx-data: "[B3]"
1543-1611 uart: rx-data: "[93]"
1628-1696 uart: rx-data: "[91]"
1713-1781 uart: rx-data: "[91]"
1798-1866 uart: rx-data: "[91]"
1883-1951 uart: rx-data: "[91]"
1968-2036 uart: rx-data: "[91]"
2053-2121 uart: rx-data: "[91]"
2138-2206 uart: rx-data: "[91]"
2223-2291 uart: rx-data: "[91]"
2308-2376 uart: rx-data: "[91]"
2393-2461 uart: rx-data: "[91]"
2478-2546 uart: rx-data: "[91]"
2563-2631 uart: rx-data: "[91]"
2648-2716 uart: rx-data: "[91]"
2733-2801 uart: rx-data: "[91]"
2818-2886 uart: rx-data: "[91]"
2903-2971 uart: rx-data: "[91]"
2988-3056 uart: rx-data: "[91]"
3073-3141 uart: rx-data: "[91]"
3158-3226 uart: rx-data: "[91]"
3243-3311 uart: rx-data: "[91]"
3328-3396 uart: rx-data: "[91]"
3413-3481 uart: rx-data: "[91]"
3498-3566 uart: rx-data: "[91]"
3583-3651 uart: rx-data: "[91]"
3668-3736 uart: rx-data: "[91]"
3753-3821 uart: rx-data: "[91]"
3838-3906 uart: rx-data: "[91]"
3923-3991 uart: rx-data: "[91]"
4008-4076 uart: rx-data: "[91]"
4093-4161 uart: rx-data: "[91]"
4178-4246 uart: rx-data: "[91]"
4263-4331 uart: rx-data: "[91]"
4348-4416 uart: rx-data: "[91]"
4433-4501 uart: rx-data: "[91]"
4518-4586 uart: rx-data: "[91]"
4603-4671 uart: rx-data: "[91]"
4688-4756 uart: rx-data: "[91]"
4773-4841 uart: rx-data: "[91]"
4858-4926 uart: rx-data: "[91]"
4943-5011 uart: rx-data: "[91]"
5028-5096 uart: rx-data: "[91]"
5113-5181 uart: rx-data: "[91]"
5198-5266 uart: rx-data: "[91]"
5283-5351 uart: rx-data: "[91]"
5368-5436 uart: rx-data: "[91]"
5453-5521 uart: rx-data: "[91]"
5538-5606 uart: rx-data: "[91]"
5623-5691 uart: rx-data: "[91]"
5708-5776 uart: rx-data: "[91]"
5793-5861 uart: rx-data: "[91]"
5878-5946 uart: rx-data: "[91]"
5963-6031 uart: rx-data: "[91]"
6048-6116 uart: rx-data: "[91]"
6133-6201 uart: rx-data: "1"
35118-35186 uart: rx-data: "H"
35212-35280 uart: rx-data: "E"
35305-35373 uart: rx-data: "L"
35399-35467 uart: rx-data: "L"
35485-35553 uart: rx-data: "O"
35570-35638 uart: rx-data: "!"
35655-35723 uart: rx-data: " "
35749-35817 uart: rx-data: "B"
35834-35902 uart: rx-data: "O"
35920-35988 uart: rx-data: "O"
36005-36073 uart: rx-data: "T"
36099-36167 uart: rx-data: "0"
36184-36252 uart: rx-data: " "
36270-36338 uart: rx-data: "i"
36355-36423 uart: rx-data: "s"
36449-36517 uart: rx-data: " "
36534-36602 uart: rx-data: "s"
36620-36688 uart: rx-data: "t"
36705-36773 uart: rx-data: "a"
36799-36867 uart: rx-data: "r"
36884-36952 uart: rx-data: "t"
36969-37037 uart: rx-data: "i"
37055-37123 uart: rx-data: "n"
37149-37217 uart: rx-data: "g"
37234-37302 uart: rx-data: "!"
37328-37396 uart: rx-data: "[0D]"
37422-37490 uart: rx-data: "[0A]"
38009-38077 uart: rx-data: "i"
38103-38171 uart: rx-data: "n"
38197-38265 uart: rx-data: "i"
38282-38350 uart: rx-data: "t"
38367-38435 uart: rx-data: "i"
38461-38529 uart: rx-data: "a"
38547-38615 uart: rx-data: "l"
38632-38700 uart: rx-data: "i"
38717-38785 uart: rx-data: "z"
38811-38879 uart: rx-data: "i"
38896-38964 uart: rx-data: "n"
38982-39050 uart: rx-data: "g"
39067-39135 uart: rx-data: " "
39161-39229 uart: rx-data: "S"
39246-39314 uart: rx-data: "D"
39332-39400 uart: rx-data: "R"
39417-39485 uart: rx-data: "A"
39511-39579 uart: rx-data: "M"
39596-39664 uart: rx-data: " "
39682-39750 uart: rx-data: "O"
39767-39835 uart: rx-data: "K"
39861-39929 uart: rx-data: "."
39955-40023 uart: rx-data: "[0D]"
40048-40116 uart: rx-data: "[0A]"
40250-40318 uart: rx-data: "S"
40343-40411 uart: rx-data: "u"
40429-40497 uart: rx-data: "c"
40514-40582 uart: rx-data: "c"
40599-40667 uart: rx-data: "e"
40693-40761 uart: rx-data: "e"
40779-40847 uart: rx-data: "d"
40864-40932 uart: rx-data: " "
40949-41017 uart: rx-data: "i"
41043-41111 uart: rx-data: "n"
41129-41197 uart: rx-data: " "
41214-41282 uart: rx-data: "o"
41299-41367 uart: rx-data: "p"
41393-41461 uart: rx-data: "e"
41478-41546 uart: rx-data: "n"
41564-41632 uart: rx-data: "i"
41649-41717 uart: rx-data: "n"
41743-41811 uart: rx-data: "g"
41828-41896 uart: rx-data: " "
41914-41982 uart: rx-data: "n"
41999-42067 uart: rx-data: "a"
42093-42161 uart: rx-data: "n"
42178-42246 uart: rx-data: "d"
42263-42331 uart: rx-data: " "
42349-42417 uart: rx-data: "f"
42443-42511 uart: rx-data: "l"
42528-42596 uart: rx-data: "a"
42613-42681 uart: rx-data: "s"
42699-42767 uart: rx-data: "h"
42793-42861 uart: rx-data: "."
42886-42954 uart: rx-data: "[0D]"
42980-43048 uart: rx-data: "[0A]"
44525-44593 uart: rx-data: "S"
44611-44679 uart: rx-data: "u"
44696-44764 uart: rx-data: "c"
44790-44858 uart: rx-data: "c"
44875-44943 uart: rx-data: "e"
44961-45029 uart: rx-data: "e"
45046-45114 uart: rx-data: "d"
45140-45208 uart: rx-data: " "
45225-45293 uart: rx-data: "i"
45311-45379 uart: rx-data: "n"
45396-45464 uart: rx-data: " "
45490-45558 uart: rx-data: "r"
45575-45643 uart: rx-data: "e"
45660-45728 uart: rx-data: "a"
45746-45814 uart: rx-data: "d"
45840-45908 uart: rx-data: "i"
45925-45993 uart: rx-data: "n"
46010-46078 uart: rx-data: "g"
46096-46164 uart: rx-data: " "
46189-46257 uart: rx-data: "B"
46275-46343 uart: rx-data: "o"
46360-46428 uart: rx-data: "o"
46446-46514 uart: rx-data: "t"
46539-46607 uart: rx-data: "1"
46625-46693 uart: rx-data: " "
46710-46778 uart: rx-data: "f"
46795-46863 uart: rx-data: "i"
46889-46957 uart: rx-data: "l"
46975-47043 uart: rx-data: "e"
47060-47128 uart: rx-data: " "
47145-47213 uart: rx-data: "h"
47239-47307 uart: rx-data: "e"
47324-47392 uart: rx-data: "a"
47410-47478 uart: rx-data: "d"
47495-47563 uart: rx-data: "."
47580-47648 uart: rx-data: "[0D]"
47674-47742 uart: rx-data: "[0A]"
47768-47836 uart: rx-data: "T"
47862-47930 uart: rx-data: "h"
47947-48015 uart: rx-data: "e"
48041-48109 uart: rx-data: " "
48127-48195 uart: rx-data: "s"
48212-48280 uart: rx-data: "i"
48297-48365 uart: rx-data: "z"
48391-48459 uart: rx-data: "e"
48477-48545 uart: rx-data: " "
48562-48630 uart: rx-data: "o"
48647-48715 uart: rx-data: "f"
48741-48809 uart: rx-data: " "
48826-48894 uart: rx-data: "B"
48912-48980 uart: rx-data: "o"
48997-49065 uart: rx-data: "o"
49091-49159 uart: rx-data: "t"
49176-49244 uart: rx-data: "1"
49262-49330 uart: rx-data: " "
49347-49415 uart: rx-data: "i"
49441-49509 uart: rx-data: "s"
49526-49594 uart: rx-data: " "
49620-49688 uart: rx-data: "0"
49714-49782 uart: rx-data: "x"
49808-49876 uart: rx-data: "0"
49902-49970 uart: rx-data: "0"
49995-50063 uart: rx-data: "0"
50089-50157 uart: rx-data: "3"
50183-50251 uart: rx-data: "0"
50277-50345 uart: rx-data: "0"
50362-50430 uart: rx-data: "0"
50456-50524 uart: rx-data: "0"
50542-50610 uart: rx-data: "."
50636-50704 uart: rx-data: "[0D]"
50729-50797 uart: rx-data: "[0A]"
82239-82307 uart: rx-data: "T"
82333-82401 uart: rx-data: "h"
82418-82486 uart: rx-data: "e"
82503-82571 uart: rx-data: " "
82597-82665 uart: rx-data: "f"
82682-82750 uart: rx-data: "i"
82768-82836 uart: rx-data: "l"
82853-82921 uart: rx-data: "e"
82947-83015 uart: rx-data: " "
83032-83100 uart: rx-data: "s"
83118-83186 uart: rx-data: "t"
83203-83271 uart: rx-data: "o"
83297-83365 uart: rx-data: "r"
83382-83450 uart: rx-data: "e"
83467-83535 uart: rx-data: "d"
83553-83621 uart: rx-data: " "
83647-83715 uart: rx-data: "i"
83732-83800 uart: rx-data: "n"
83817-83885 uart: rx-data: " "
83903-83971 uart: rx-data: "0"
83997-84065 uart: rx-data: "X"
84090-84158 uart: rx-data: "0"
84184-84252 uart: rx-data: "0"
84278-84346 uart: rx-data: "0"
84372-84440 uart: rx-data: "0"
84457-84525 uart: rx-data: "0"
84551-84619 uart: rx-data: "0"
84645-84713 uart: rx-data: "0"
84739-84807 uart: rx-data: "0"
84824-84892 uart: rx-data: " "
84910-84978 uart: rx-data: "o"
85004-85072 uart: rx-data: "f"
85089-85157 uart: rx-data: " "
85174-85242 uart: rx-data: "b"
85260-85328 uart: rx-data: "l"
85353-85421 uart: rx-data: "o"
85439-85507 uart: rx-data: "c"
85524-85592 uart: rx-data: "k"
85609-85677 uart: rx-data: " "
85703-85771 uart: rx-data: "2"
85797-85865 uart: rx-data: " "
85891-85959 uart: rx-data: "i"
85985-86053 uart: rx-data: "s"
86070-86138 uart: rx-data: " "
86156-86224 uart: rx-data: "p"
86241-86309 uart: rx-data: "e"
86335-86403 uart: rx-data: "r"
86420-86488 uart: rx-data: "f"
86505-86573 uart: rx-data: "e"
86591-86659 uart: rx-data: "c"
86685-86753 uart: rx-data: "t"
86770-86838 uart: rx-data: "."
86864-86932 uart: rx-data: "[0D]"
86958-87026 uart: rx-data: "[0A]"
87043-87111 uart: rx-data: "C"
87128-87196 uart: rx-data: "h"
87222-87290 uart: rx-data: "e"
87308-87376 uart: rx-data: "c"
87393-87461 uart: rx-data: "k"
87478-87546 uart: rx-data: " "
87572-87640 uart: rx-data: "i"
87657-87725 uart: rx-data: "s"
87743-87811 uart: rx-data: " "
87828-87896 uart: rx-data: "c"
87922-87990 uart: rx-data: "o"
88007-88075 uart: rx-data: "r"
88093-88161 uart: rx-data: "r"
88178-88246 uart: rx-data: "e"
88272-88340 uart: rx-data: "c"
88357-88425 uart: rx-data: "t"
88443-88511 uart: rx-data: "."
88528-88596 uart: rx-data: "[0D]"
88622-88690 uart: rx-data: "[0A]"
88707-88775 uart: rx-data: "R"
88792-88860 uart: rx-data: "e"
88886-88954 uart: rx-data: "a"
88972-89040 uart: rx-data: "d"
89057-89125 uart: rx-data: "y"
89142-89210 uart: rx-data: " "
89236-89304 uart: rx-data: "t"
89322-89390 uart: rx-data: "o"
89407-89475 uart: rx-data: " "
89492-89560 uart: rx-data: "d"
89586-89654 uart: rx-data: "i"
89671-89739 uart: rx-data: "s"
89757-89825 uart: rx-data: "a"
89842-89910 uart: rx-data: "b"
89936-90004 uart: rx-data: "l"
90021-90089 uart: rx-data: "e"
90107-90175 uart: rx-data: " "
90192-90260 uart: rx-data: "i"
90286-90354 uart: rx-data: "c"
90371-90439 uart: rx-data: "a"
90457-90525 uart: rx-data: "c"
90542-90610 uart: rx-data: "h"
90636-90704 uart: rx-data: "e"
90721-90789 uart: rx-data: "."
90815-90883 uart: rx-data: "[0D]"
90909-90977 uart: rx-data: "[0A]"
91003-91071 uart: rx-data: "S"
91088-91156 uart: rx-data: "u"
91182-91250 uart: rx-data: "c"
91276-91344 uart: rx-data: "c"
91370-91438 uart: rx-data: "e"
91463-91531 uart: rx-data: "e"
91557-91625 uart: rx-data: "d"
91643-91711 uart: rx-data: " "
91737-91805 uart: rx-data: "i"
91830-91898 uart: rx-data: "n"
91924-91992 uart: rx-data: " "
92018-92086 uart: rx-data: "l"
92112-92180 uart: rx-data: "o"
92197-92265 uart: rx-data: "a"
92291-92359 uart: rx-data: "d"
92385-92453 uart: rx-data: "i"
92479-92547 uart: rx-data: "n"
92573-92641 uart: rx-data: "g"
92667-92735 uart: rx-data: " "
92752-92820 uart: rx-data: "B"
92846-92914 uart: rx-data: "o"
92940-93008 uart: rx-data: "o"
93034-93102 uart: rx-data: "t"
93128-93196 uart: rx-data: "1"
93221-93289 uart: rx-data: "."
93315-93383 uart: rx-data: "[0D]"
93409-93477 uart: rx-data: "[0A]"
93503-93571 uart: rx-data: "J"
93597-93665 uart: rx-data: "u"
93691-93759 uart: rx-data: "m"
93785-93853 uart: rx-data: "p"
93878-93946 uart: rx-data: " "
93972-94040 uart: rx-data: "t"
94066-94134 uart: rx-data: "o"
94152-94220 uart: rx-data: " "
94245-94313 uart: rx-data: "B"
94339-94407 uart: rx-data: "o"
94433-94501 uart: rx-data: "o"
94527-94595 uart: rx-data: "t"
94621-94689 uart: rx-data: "1"
94706-94774 uart: rx-data: "."
94800-94868 uart: rx-data: "[0D]"
94894-94962 uart: rx-data: "[0A]"
103116-103184 uart: rx-data: "b"
103202-103270 uart: rx-data: "e"
103289-103357 uart: rx-data: "g"
103375-103443 uart: rx-data: "i"
103462-103530 uart: rx-data: "n"
103548-103616 uart: rx-data: " "
103635-103703 uart: rx-data: "t"
103721-103789 uart: rx-data: "o"
103808-103876 uart: rx-data: " "
103894-103962 uart: rx-data: "i"
103980-104048 uart: rx-data: "n"
104067-104135 uart: rx-data: "i"
104153-104221 uart: rx-data: "t"
104240-104308 uart: rx-data: " "
104326-104394 uart: rx-data: "f"
104413-104481 uart: rx-data: "i"
104499-104567 uart: rx-data: "l"
104585-104653 uart: rx-data: "e"
104672-104740 uart: rx-data: " "
104758-104826 uart: rx-data: "s"
104845-104913 uart: rx-data: "y"
104931-104999 uart: rx-data: "s"
105018-105086 uart: rx-data: "t"
105104-105172 uart: rx-data: "e"
105191-105259 uart: rx-data: "m"
105277-105345 uart: rx-data: "[0D]"
105363-105431 uart: rx-data: "[0A]"
105450-105518 uart: rx-data: "b"
105536-105604 uart: rx-data: "a"
105623-105691 uart: rx-data: "t"
105709-105777 uart: rx-data: " "
105796-105864 uart: rx-data: "v"
105882-105950 uart: rx-data: "o"
105969-106037 uart: rx-data: "l"
106055-106123 uart: rx-data: " "
106141-106209 uart: rx-data: "="
106228-106296 uart: rx-data: " "
106314-106382 uart: rx-data: "3"
106401-106469 uart: rx-data: "9"
106487-106555 uart: rx-data: "9"
106574-106642 uart: rx-data: "1"
106660-106728 uart: rx-data: "[0D]"
106746-106814 uart: rx-data: "[0A]"
122618-122686 uart: rx-data: "1"
122704-122772 uart: rx-data: "[0D]"
122791-122859 uart: rx-data: "[0A]"
150309-150377 uart: rx-data: "m"
150396-150464 uart: rx-data: "o"
150482-150550 uart: rx-data: "u"
150569-150637 uart: rx-data: "n"
150655-150723 uart: rx-data: "t"
150741-150809 uart: rx-data: " "
150828-150896 uart: rx-data: "s"
150914-150982 uart: rx-data: "u"
151001-151069 uart: rx-data: "c"
151087-151155 uart: rx-data: "c"
151174-151242 uart: rx-data: "e"
151260-151328 uart: rx-data: "s"
151347-151415 uart: rx-data: "s"
151433-151501 uart: rx-data: "f"
151519-151587 uart: rx-data: "u"
151606-151674 uart: rx-data: "l"
151692-151760 uart: rx-data: "l"
151779-151847 uart: rx-data: "y"
151865-151933 uart: rx-data: "."
151952-152020 uart: rx-data: "[0D]"
152038-152106 uart: rx-data: "[0A]"
152125-152193 uart: rx-data: "0"
152211-152279 uart: rx-data: "[0D]"
152297-152365 uart: rx-data: "[0A]"
302194-302262 uart: rx-data: "S"
302280-302348 uart: rx-data: "o"
302367-302435 uart: rx-data: "u"
302453-302521 uart: rx-data: "r"
302540-302608 uart: rx-data: "c"
302626-302694 uart: rx-data: "e"
302713-302781 uart: rx-data: " "
302799-302867 uart: rx-data: "c"
302886-302954 uart: rx-data: "l"
302972-303040 uart: rx-data: "o"
303058-303126 uart: rx-data: "c"
303145-303213 uart: rx-data: "k"
303231-303299 uart: rx-data: " "
303318-303386 uart: rx-data: "i"
303404-303472 uart: rx-data: "s"
303491-303559 uart: rx-data: " "
303577-303645 uart: rx-data: "H"
303663-303731 uart: rx-data: "O"
303750-303818 uart: rx-data: "S"
303836-303904 uart: rx-data: "C"
303923-303991 uart: rx-data: ","
304009-304077 uart: rx-data: " "
304096-304164 uart: rx-data: "p"
304182-304250 uart: rx-data: "r"
304269-304337 uart: rx-data: "e"
304355-304423 uart: rx-data: "S"
304441-304509 uart: rx-data: "c"
304528-304596 uart: rx-data: "a"
304614-304682 uart: rx-data: "l"
304701-304769 uart: rx-data: "e"
304787-304855 uart: rx-data: "="
304874-304942 uart: rx-data: "6"
304960-305028 uart: rx-data: "4"
305047-305115 uart: rx-data: ","
305133-305201 uart: rx-data: " "
305219-305287 uart: rx-data: "i"
305306-305374 uart: rx-data: "n"
305392-305460 uart: rx-data: "t"
305479-305547 uart: rx-data: "e"
305565-305633 uart: rx-data: "r"
305652-305720 uart: rx-data: "v"
305738-305806 uart: rx-data: "a"
305824-305892 uart: rx-data: "l"
305911-305979 uart: rx-data: "="
305997-306065 uart: rx-data: "3"
306084-306152 uart: rx-data: "7"
306170-306238 uart: rx-data: "5"
306257-306325 uart: rx-data: "[0D]"
306343-306411 uart: rx-data: "[0A]"
306430-306498 uart: rx-data: "[00]"
306516-306584 uart: rx-data: "[0D]"
306602-306670 uart: rx-data: "[0A]"
306689-306757 uart: rx-data: "[00]"
314922-314990 uart: rx-data: "M"
315008-315076 uart: rx-data: "o"
315095-315163 uart: rx-data: "u"
315181-315249 uart: rx-data: "n"
315267-315335 uart: rx-data: "t"
315354-315422 uart: rx-data: " "
315440-315508 uart: rx-data: "P"
315527-315595 uart: rx-data: "a"
315613-315681 uart: rx-data: "r"
315700-315768 uart: rx-data: "t"
315786-315854 uart: rx-data: "s"
315873-315941 uart: rx-data: " "
315959-316027 uart: rx-data: "T"
316045-316113 uart: rx-data: "h"
316132-316200 uart: rx-data: "r"
316218-316286 uart: rx-data: "e"
316305-316373 uart: rx-data: "a"
316391-316459 uart: rx-data: "d"
316478-316546 uart: rx-data: " "
316564-316632 uart: rx-data: "r"
316650-316718 uart: rx-data: "u"
316737-316805 uart: rx-data: "n"
316823-316891 uart: rx-data: "n"
316910-316978 uart: rx-data: "i"
316996-317064 uart: rx-data: "n"
317083-317151 uart: rx-data: "g"
317169-317237 uart: rx-data: "."
317256-317324 uart: rx-data: "."
317342-317410 uart: rx-data: "."
317428-317496 uart: rx-data: "."
317515-317583 uart: rx-data: "."
317601-317669 uart: rx-data: "[0D]"
317688-317756 uart: rx-data: "[0A]"
317774-317842 uart: rx-data: "[00]"
429123-429191 uart: rx-data: "[0D]"
429211-429279 uart: rx-data: "[0A]"
429299-429367 uart: rx-data: "[00]"
434315-434383 uart: rx-data: "[0D]"
434403-434471 uart: rx-data: "[0A]"
434491-434559 uart: rx-data: "[00]"
438605-438673 uart: rx-data: "M"
438693-438761 uart: rx-data: "o"
438781-438849 uart: rx-data: "u"
438869-438937 uart: rx-data: "n"
438957-439025 uart: rx-data: "t"
439045-439113 uart: rx-data: " "
439133-439201 uart: rx-data: "P"
439221-439289 uart: rx-data: "a"
439309-439377 uart: rx-data: "r"
439397-439465 uart: rx-data: "t"
439485-439553 uart: rx-data: "s"
439573-439641 uart: rx-data: " "
439661-439729 uart: rx-data: "T"
439750-439818 uart: rx-data: "h"
439838-439906 uart: rx-data: "r"
439926-439994 uart: rx-data: "e"
440014-440082 uart: rx-data: "a"
440102-440170 uart: rx-data: "d"
440190-440258 uart: rx-data: " "
440278-440346 uart: rx-data: "w"
440366-440434 uart: rx-data: "o"
440454-440522 uart: rx-data: "r"
440542-440610 uart: rx-data: "k"
440630-440698 uart: rx-data: " "
440718-440786 uart: rx-data: "n"
440806-440874 uart: rx-data: "o"
440894-440962 uart: rx-data: "w"
440982-441050 uart: rx-data: "."
441070-441138 uart: rx-data: "."
441158-441226 uart: rx-data: "."
441246-441314 uart: rx-data: "."
441334-441402 uart: rx-data: "."
441422-441490 uart: rx-data: "[0D]"
441510-441578 uart: rx-data: "[0A]"
441598-441666 uart: rx-data: "[00]"
441686-441754 uart: rx-data: "[0D]"
441774-441842 uart: rx-data: "[0A]"
441862-441930 uart: rx-data: "[00]"
445549-445617 uart: rx-data: "M"
445637-445705 uart: rx-data: "o"
445725-445793 uart: rx-data: "u"
445813-445881 uart: rx-data: "n"
445901-445969 uart: rx-data: "t"
445989-446057 uart: rx-data: " "
446077-446145 uart: rx-data: "P"
446165-446233 uart: rx-data: "a"
446253-446321 uart: rx-data: "r"
446341-446409 uart: rx-data: "t"
446429-446497 uart: rx-data: "s"
446517-446585 uart: rx-data: " "
446605-446673 uart: rx-data: "T"
446693-446761 uart: rx-data: "h"
446781-446849 uart: rx-data: "r"
446869-446937 uart: rx-data: "e"
446957-447025 uart: rx-data: "a"
447045-447113 uart: rx-data: "d"
447133-447201 uart: rx-data: " "
447221-447289 uart: rx-data: "w"
447309-447377 uart: rx-data: "o"
447397-447465 uart: rx-data: "r"
447485-447553 uart: rx-data: "k"
447573-447641 uart: rx-data: " "
447662-447730 uart: rx-data: "e"
447750-447818 uart: rx-data: "n"
447838-447906 uart: rx-data: "d"
447926-447994 uart: rx-data: "."
448014-448082 uart: rx-data: "."
448102-448170 uart: rx-data: "."
448190-448258 uart: rx-data: "."
448278-448346 uart: rx-data: "[0D]"
448366-448434 uart: rx-data: "[0A]"
448454-448522 uart: rx-data: "[00]"
842679-842747 uart: rx-data: "."
842766-842834 uart: rx-data: "."
842852-842920 uart: rx-data: "."
842939-843007 uart: rx-data: "."
843025-843093 uart: rx-data: "."
843111-843179 uart: rx-data: "."
843198-843266 uart: rx-data: "."
843284-843352 uart: rx-data: "."
843371-843439 uart: rx-data: "."
843457-843525 uart: rx-data: "."
843544-843612 uart: rx-data: "."
843630-843698 uart: rx-data: "."
843716-843784 uart: rx-data: "."
843803-843871 uart: rx-data: "."
843889-843957 uart: rx-data: "."
843976-844044 uart: rx-data: "."
844062-844130 uart: rx-data: "."
844149-844217 uart: rx-data: "."
844235-844303 uart: rx-data: "."
844322-844390 uart: rx-data: "."
844408-844476 uart: rx-data: "."
844494-844562 uart: rx-data: "."
844581-844649 uart: rx-data: "."
844667-844735 uart: rx-data: "."
844754-844822 uart: rx-data: "."
844840-844908 uart: rx-data: "."
844927-844995 uart: rx-data: "."
845013-845081 uart: rx-data: "."
845100-845168 uart: rx-data: "."
845186-845254 uart: rx-data: "."
845272-845340 uart: rx-data: "."
845359-845427 uart: rx-data: "."
845445-845513 uart: rx-data: "."
845532-845600 uart: rx-data: "."
845618-845686 uart: rx-data: "."
845705-845773 uart: rx-data: "."
845791-845859 uart: rx-data: "."
845877-845945 uart: rx-data: "."
845964-846032 uart: rx-data: "."
846050-846118 uart: rx-data: "."
846137-846205 uart: rx-data: "."
846223-846291 uart: rx-data: "."
846310-846378 uart: rx-data: "."
846396-846464 uart: rx-data: "."
846483-846551 uart: rx-data: "."
846569-846637 uart: rx-data: "."
846655-846723 uart: rx-data: "."
846742-846810 uart: rx-data: "."
846828-846896 uart: rx-data: "."
846915-846983 uart: rx-data: "."
847001-847069 uart: rx-data: "."
847088-847156 uart: rx-data: "."
847174-847242 uart: rx-data: "."
847261-847329 uart: rx-data: "."
847347-847415 uart: rx-data: "."
847433-847501 uart: rx-data: "."
847520-847588 uart: rx-data: "."
847606-847674 uart: rx-data: "."
847693-847761 uart: rx-data: "."
847779-847847 uart: rx-data: "."
847866-847934 uart: rx-data: "."
847952-848020 uart: rx-data: "."
848038-848106 uart: rx-data: "."
848125-848193 uart: rx-data: "."
848211-848279 uart: rx-data: "."
848298-848366 uart: rx-data: "."
848384-848452 uart: rx-data: "."
848471-848539 uart: rx-data: "."
848557-848625 uart: rx-data: "."
848644-848712 uart: rx-data: "."
848730-848798 uart: rx-data: "."
848816-848884 uart: rx-data: "."
848903-848971 uart: rx-data: "."
848989-849057 uart: rx-data: "."
849076-849144 uart: rx-data: "."
849162-849230 uart: rx-data: "."
849249-849317 uart: rx-data: "."
849335-849403 uart: rx-data: "."
849421-849489 uart: rx-data: "."
849508-849576 uart: rx-data: "."
849594-849662 uart: rx-data: "."
849681-849749 uart: rx-data: "."
849767-849835 uart: rx-data: "."
849854-849922 uart: rx-data: "."
849940-850008 uart: rx-data: "."
850027-850095 uart: rx-data: "."
850113-850181 uart: rx-data: "."
850199-850267 uart: rx-data: "."
850286-850354 uart: rx-data: "."
850372-850440 uart: rx-data: "."
850459-850527 uart: rx-data: "."
850545-850613 uart: rx-data: "."
850632-850700 uart: rx-data: "."
850718-850786 uart: rx-data: "."
850805-850873 uart: rx-data: "."
850891-850959 uart: rx-data: "."
850977-851045 uart: rx-data: "."
851064-851132 uart: rx-data: "."
851150-851218 uart: rx-data: "."
851237-851305 uart: rx-data: "."
851323-851391 uart: rx-data: "."
851410-851478 uart: rx-data: "."
851496-851564 uart: rx-data: "."
851582-851650 uart: rx-data: "."
851669-851737 uart: rx-data: "."
851755-851823 uart: rx-data: "."
851842-851910 uart: rx-data: "."
851928-851996 uart: rx-data: "."
852015-852083 uart: rx-data: "."
852101-852169 uart: rx-data: "."
852188-852256 uart: rx-data: "."
852274-852342 uart: rx-data: "."
852360-852428 uart: rx-data: "."
852447-852515 uart: rx-data: "."
852533-852601 uart: rx-data: "."
852620-852688 uart: rx-data: "."
852706-852774 uart: rx-data: "."
852793-852861 uart: rx-data: "[0D]"
852879-852947 uart: rx-data: "[0A]"
852966-853034 uart: rx-data: "[00]"
853052-853120 uart: rx-data: "."
853138-853206 uart: rx-data: "P"
853225-853293 uart: rx-data: "l"
853311-853379 uart: rx-data: "e"
853398-853466 uart: rx-data: "a"
853484-853552 uart: rx-data: "s"
853571-853639 uart: rx-data: "e"
853657-853725 uart: rx-data: " "
853743-853811 uart: rx-data: "p"
853830-853898 uart: rx-data: "r"
853916-853984 uart: rx-data: "e"
854003-854071 uart: rx-data: "s"
854089-854157 uart: rx-data: "s"
854176-854244 uart: rx-data: " "
854262-854330 uart: rx-data: "e"
854349-854417 uart: rx-data: "n"
854435-854503 uart: rx-data: "t"
854521-854589 uart: rx-data: "e"
854608-854676 uart: rx-data: "r"
854694-854762 uart: rx-data: " "
854781-854849 uart: rx-data: "k"
854867-854935 uart: rx-data: "e"
854954-855022 uart: rx-data: "y"
855040-855108 uart: rx-data: "("
855126-855194 uart: rx-data: "k"
855213-855281 uart: rx-data: "e"
855299-855367 uart: rx-data: "y"
855386-855454 uart: rx-data: "p"
855472-855540 uart: rx-data: "a"
855559-855627 uart: rx-data: "d"
855645-855713 uart: rx-data: " "
855732-855800 uart: rx-data: "o"
855818-855886 uart: rx-data: "r"
855904-855972 uart: rx-data: " "
855991-856059 uart: rx-data: "i"
856077-856145 uart: rx-data: "r"
856164-856232 uart: rx-data: "k"
856250-856318 uart: rx-data: "e"
856337-856405 uart: rx-data: "y"
856423-856491 uart: rx-data: ")"
856510-856578 uart: rx-data: " "
856596-856664 uart: rx-data: "t"
856682-856750 uart: rx-data: "o"
856769-856837 uart: rx-data: " "
856855-856923 uart: rx-data: "c"
856942-857010 uart: rx-data: "o"
857028-857096 uart: rx-data: "n"
857115-857183 uart: rx-data: "t"
857201-857269 uart: rx-data: "i"
857287-857355 uart: rx-data: "n"
857374-857442 uart: rx-data: "u"
857460-857528 uart: rx-data: "e"
857547-857615 uart: rx-data: "!"
857633-857701 uart: rx-data: "[0D]"
857720-857788 uart: rx-data: "[0A]"
857806-857874 uart: rx-data: "."
857893-857961 uart: rx-data: "."
857979-858047 uart: rx-data: "."
858065-858133 uart: rx-data: "."
858152-858220 uart: rx-data: "."
858238-858306 uart: rx-data: "."
858325-858393 uart: rx-data: "."
858411-858479 uart: rx-data: "."
858498-858566 uart: rx-data: "."
858584-858652 uart: rx-data: "."
858671-858739 uart: rx-data: "."
858757-858825 uart: rx-data: "."
858843-858911 uart: rx-data: "."
858930-858998 uart: rx-data: "."
859016-859084 uart: rx-data: "."
859103-859171 uart: rx-data: "."
859189-859257 uart: rx-data: "."
859276-859344 uart: rx-data: "."
859362-859430 uart: rx-data: "."
859448-859516 uart: rx-data: "."
859535-859603 uart: rx-data: "."
859621-859689 uart: rx-data: "."
859708-859776 uart: rx-data: "."
859794-859862 uart: rx-data: "."
859881-859949 uart: rx-data: "."
859967-860035 uart: rx-data: "."
860054-860122 uart: rx-data: "."
860140-860208 uart: rx-data: "."
860226-860294 uart: rx-data: "."
860313-860381 uart: rx-data: "."
860399-860467 uart: rx-data: "."
860486-860554 uart: rx-data: "."
860572-860640 uart: rx-data: "."
860659-860727 uart: rx-data: "."
860745-860813 uart: rx-data: "."
860832-860900 uart: rx-data: "."
860918-860986 uart: rx-data: "."
861004-861072 uart: rx-data: "."
861091-861159 uart: rx-data: "."
861177-861245 uart: rx-data: "."
861264-861332 uart: rx-data: "."
861350-861418 uart: rx-data: "."
861437-861505 uart: rx-data: "."
861523-861591 uart: rx-data: "."
861609-861677 uart: rx-data: "."
861696-861764 uart: rx-data: "."
861782-861850 uart: rx-data: "."
861869-861937 uart: rx-data: "."
861955-862023 uart: rx-data: "."
862042-862110 uart: rx-data: "."
862128-862196 uart: rx-data: "."
862215-862283 uart: rx-data: "."
862301-862369 uart: rx-data: "."
862387-862455 uart: rx-data: "."
862474-862542 uart: rx-data: "."
862560-862628 uart: rx-data: "."
862647-862715 uart: rx-data: "."
862733-862801 uart: rx-data: "."
862820-862888 uart: rx-data: "."
862906-862974 uart: rx-data: "."
862992-863060 uart: rx-data: "."
863079-863147 uart: rx-data: "."
863165-863233 uart: rx-data: "[0D]"
863252-863320 uart: rx-data: "[0A]"
863338-863406 uart: rx-data: "[00]"
863425-863493 uart: rx-data: "."
863511-863579 uart: rx-data: "."
863598-863666 uart: rx-data: "."
863684-863752 uart: rx-data: "."
863770-863838 uart: rx-data: "."
863857-863925 uart: rx-data: "."
863943-864011 uart: rx-data: "."
864030-864098 uart: rx-data: "."
864116-864184 uart: rx-data: "."
864203-864271 uart: rx-data: "."
864289-864357 uart: rx-data: "."
864376-864444 uart: rx-data: "."
864462-864530 uart: rx-data: "."
864548-864616 uart: rx-data: "."
864635-864703 uart: rx-data: "."
864721-864789 uart: rx-data: "."
864808-864876 uart: rx-data: "."
864894-864962 uart: rx-data: "."
864981-865049 uart: rx-data: "."
865067-865135 uart: rx-data: "."
865153-865221 uart: rx-data: "."
865240-865308 uart: rx-data: "."
865326-865394 uart: rx-data: "."
865413-865481 uart: rx-data: "."
865499-865567 uart: rx-data: "."
865586-865654 uart: rx-data: "."
865672-865740 uart: rx-data: "."
865759-865827 uart: rx-data: "."
865845-865913 uart: rx-data: "."
865931-865999 uart: rx-data: "."
866018-866086 uart: rx-data: "."
866104-866172 uart: rx-data: "."
866191-866259 uart: rx-data: "."
866277-866345 uart: rx-data: "."
866364-866432 uart: rx-data: "."
866450-866518 uart: rx-data: "."
866537-866605 uart: rx-data: "."
866623-866691 uart: rx-data: "."
866709-866777 uart: rx-data: "."
866796-866864 uart: rx-data: "."
866882-866950 uart: rx-data: "."
866969-867037 uart: rx-data: "."
867055-867123 uart: rx-data: "."
867142-867210 uart: rx-data: "."
867228-867296 uart: rx-data: "."
867314-867382 uart: rx-data: "."
867401-867469 uart: rx-data: "."
867487-867555 uart: rx-data: "."
867574-867642 uart: rx-data: "."
867660-867728 uart: rx-data: "."
867747-867815 uart: rx-data: "."
867833-867901 uart: rx-data: "."
867920-867988 uart: rx-data: "."
868006-868074 uart: rx-data: "."
868092-868160 uart: rx-data: "."
868179-868247 uart: rx-data: "."
868265-868333 uart: rx-data: "."
868352-868420 uart: rx-data: "."
868438-868506 uart: rx-data: "."
868525-868593 uart: rx-data: "."
868611-868679 uart: rx-data: "."
868698-868766 uart: rx-data: "."
868784-868852 uart: rx-data: "."
868870-868938 uart: rx-data: "."
868957-869025 uart: rx-data: "."
869043-869111 uart: rx-data: "."
869130-869198 uart: rx-data: "."
869216-869284 uart: rx-data: "."
869303-869371 uart: rx-data: "."
869389-869457 uart: rx-data: "."
869475-869543 uart: rx-data: "."
869562-869630 uart: rx-data: "."
869648-869716 uart: rx-data: "."
869735-869803 uart: rx-data: "."
869821-869889 uart: rx-data: "."
869908-869976 uart: rx-data: "."
869994-870062 uart: rx-data: "."
870081-870149 uart: rx-data: "."
870167-870235 uart: rx-data: "."
870253-870321 uart: rx-data: "."
870340-870408 uart: rx-data: "."
870426-870494 uart: rx-data: "."
870513-870581 uart: rx-data: "."
870599-870667 uart: rx-data: "."
870686-870754 uart: rx-data: "."
870772-870840 uart: rx-data: "."
870858-870926 uart: rx-data: "."
870945-871013 uart: rx-data: "."
871031-871099 uart: rx-data: "."
871118-871186 uart: rx-data: "."
871204-871272 uart: rx-data: "."
871291-871359 uart: rx-data: "."
871377-871445 uart: rx-data: "."
871464-871532 uart: rx-data: "."
871550-871618 uart: rx-data: "."
871636-871704 uart: rx-data: "."
871723-871791 uart: rx-data: "."
871809-871877 uart: rx-data: "."
871896-871964 uart: rx-data: "."
871982-872050 uart: rx-data: "."
872069-872137 uart: rx-data: "."
872155-872223 uart: rx-data: "."
872242-872310 uart: rx-data: "."
872328-872396 uart: rx-data: "."
872414-872482 uart: rx-data: "."
872501-872569 uart: rx-data: "."
872587-872655 uart: rx-data: "."
872674-872742 uart: rx-data: "."
872760-872828 uart: rx-data: "."
872847-872915 uart: rx-data: "."
872933-873001 uart: rx-data: "."
873019-873087 uart: rx-data: "."
873106-873174 uart: rx-data: "."
873192-873260 uart: rx-data: "."
873279-873347 uart: rx-data: "."
873365-873433 uart: rx-data: "."
873452-873520 uart: rx-data: "."
873538-873606 uart: rx-data: "[0D]"
873625-873693 uart: rx-data: "[0A]"
873711-873779 uart: rx-data: "[00]"
873797-873865 uart: rx-data: "E"
873884-873952 uart: rx-data: "x"
873970-874038 uart: rx-data: "e"
874057-874125 uart: rx-data: "c"
874143-874211 uart: rx-data: "u"
874230-874298 uart: rx-data: "t"
874316-874384 uart: rx-data: "e"
874403-874471 uart: rx-data: " "
874489-874557 uart: rx-data: "s"
874575-874643 uart: rx-data: "t"
874662-874730 uart: rx-data: "a"
874748-874816 uart: rx-data: "r"
874835-874903 uart: rx-data: "t"
874921-874989 uart: rx-data: "u"
875008-875076 uart: rx-data: "p"
875094-875162 uart: rx-data: " "
875180-875248 uart: rx-data: "s"
875267-875335 uart: rx-data: "c"
875353-875421 uart: rx-data: "r"
875440-875508 uart: rx-data: "i"
875526-875594 uart: rx-data: "p"
875613-875681 uart: rx-data: "t"
875699-875767 uart: rx-data: " "
875786-875854 uart: rx-data: "b"
875872-875940 uart: rx-data: "e"
875958-876026 uart: rx-data: "g"
876045-876113 uart: rx-data: "i"
876131-876199 uart: rx-data: "n"
876218-876286 uart: rx-data: "."
876304-876372 uart: rx-data: "."
876391-876459 uart: rx-data: "."
876477-876545 uart: rx-data: "."
876564-876632 uart: rx-data: "."
876650-876718 uart: rx-data: "."
876736-876804 uart: rx-data: "."
876823-876891 uart: rx-data: "."
876909-876977 uart: rx-data: "."
876996-877064 uart: rx-data: "."
877082-877150 uart: rx-data: "."
877169-877237 uart: rx-data: "."
877255-877323 uart: rx-data: "."
877341-877409 uart: rx-data: "."
877428-877496 uart: rx-data: "[0D]"
877514-877582 uart: rx-data: "[0A]"
877601-877669 uart: rx-data: "[00]"
877687-877755 uart: rx-data: "E"
877774-877842 uart: rx-data: "s"
877860-877928 uart: rx-data: "h"
877947-878015 uart: rx-data: " "
878033-878101 uart: rx-data: "E"
878119-878187 uart: rx-data: "r"
878206-878274 uart: rx-data: "r"
878292-878360 uart: rx-data: "o"
878379-878447 uart: rx-data: "r"
878465-878533 uart: rx-data: ":"
878552-878620 uart: rx-data: " "
878638-878706 uart: rx-data: "[00]"
878724-878792 uart: rx-data: "O"
878811-878879 uart: rx-data: "p"
878897-878965 uart: rx-data: "e"
878984-879052 uart: rx-data: "n"
879070-879138 uart: rx-data: "C"
879157-879225 uart: rx-data: "o"
879243-879311 uart: rx-data: "n"
879330-879398 uart: rx-data: "f"
879416-879484 uart: rx-data: "i"
879502-879570 uart: rx-data: "g"
879589-879657 uart: rx-data: "F"
879675-879743 uart: rx-data: "i"
879762-879830 uart: rx-data: "l"
879848-879916 uart: rx-data: "e"
879935-880003 uart: rx-data: " "
880021-880089 uart: rx-data: "y"
880108-880176 uart: rx-data: ":"
880194-880262 uart: rx-data: "\"
880280-880348 uart: rx-data: "c"
880367-880435 uart: rx-data: "o"
880453-880521 uart: rx-data: "n"
880540-880608 uart: rx-data: "f"
880626-880694 uart: rx-data: "i"
880713-880781 uart: rx-data: "g"
880799-880867 uart: rx-data: "\"
880885-880953 uart: rx-data: "c"
880972-881040 uart: rx-data: "o"
881058-881126 uart: rx-data: "n"
881145-881213 uart: rx-data: "f"
881231-881299 uart: rx-data: "i"
881318-881386 uart: rx-data: "g"
881404-881472 uart: rx-data: "."
881491-881559 uart: rx-data: "b"
881577-881645 uart: rx-data: "i"
881663-881731 uart: rx-data: "n"
881750-881818 uart: rx-data: " "
881836-881904 uart: rx-data: "f"
881923-881991 uart: rx-data: "a"
882009-882077 uart: rx-data: "i"
882096-882164 uart: rx-data: "l"
882182-882250 uart: rx-data: "e"
882269-882337 uart: rx-data: "d"
882355-882423 uart: rx-data: "."
882441-882509 uart: rx-data: "[0D]"
882528-882596 uart: rx-data: "[0A]"
882614-882682 uart: rx-data: "[00]"
1028579-1028647 uart: rx-data: "."
1028666-1028734 uart: rx-data: "."
1028752-1028820 uart: rx-data: "."
1028839-1028907 uart: rx-data: "."
1028925-1028993 uart: rx-data: "."
1029012-1029080 uart: rx-data: "."
1029098-1029166 uart: rx-data: "."
1029184-1029252 uart: rx-data: "."
1029271-1029339 uart: rx-data: "."
1029357-1029425 uart: rx-data: "."
1029444-1029512 uart: rx-data: "."
1029530-1029598 uart: rx-data: "."
1029617-1029685 uart: rx-data: "."
1029703-1029771 uart: rx-data: "."
1029789-1029857 uart: rx-data: "."
1029876-1029944 uart: rx-data: "E"
1029962-1030030 uart: rx-data: "x"
1030049-1030117 uart: rx-data: "e"
1030135-1030203 uart: rx-data: "c"
1030222-1030290 uart: rx-data: "u"
1030308-1030376 uart: rx-data: "t"
1030395-1030463 uart: rx-data: "e"
1030481-1030549 uart: rx-data: " "
1030567-1030635 uart: rx-data: "s"
1030654-1030722 uart: rx-data: "t"
1030740-1030808 uart: rx-data: "a"
1030827-1030895 uart: rx-data: "r"
1031314-1031382 uart: rx-data: "t"
1031400-1031468 uart: rx-data: "u"
1031486-1031554 uart: rx-data: "p"
1031573-1031641 uart: rx-data: " "
1031659-1031727 uart: rx-data: "s"
1031746-1031814 uart: rx-data: "c"
1031832-1031900 uart: rx-data: "r"
1031919-1031987 uart: rx-data: "i"
1032005-1032073 uart: rx-data: "p"
1032091-1032159 uart: rx-data: "t"
1032178-1032246 uart: rx-data: " "
1032264-1032332 uart: rx-data: "e"
1032351-1032419 uart: rx-data: "n"
1032437-1032505 uart: rx-data: "d"
1032524-1032592 uart: rx-data: "[0D]"
1032610-1032678 uart: rx-data: "[0A]"
1032697-1032765 uart: rx-data: "[00]"
1032783-1032851 uart: rx-data: "E"
1032869-1032937 uart: rx-data: "s"
1032956-1033024 uart: rx-data: "h"
1033042-1033110 uart: rx-data: " "
1033129-1033197 uart: rx-data: "m"
1033215-1033283 uart: rx-data: "s"
1033302-1033370 uart: rx-data: "g"
1033388-1033456 uart: rx-data: ":"
1033474-1033542 uart: rx-data: " "
1033561-1033629 uart: rx-data: "[00]"
1033647-1033715 uart: rx-data: "s"
1033734-1033802 uart: rx-data: "h"
1033820-1033888 uart: rx-data: "e"
1033907-1033975 uart: rx-data: "l"
1033993-1034061 uart: rx-data: "l"
1034080-1034148 uart: rx-data: " "
1034166-1034234 uart: rx-data: "m"
1034252-1034320 uart: rx-data: "a"
1034339-1034407 uart: rx-data: "i"
1034425-1034493 uart: rx-data: "n"
1034512-1034580 uart: rx-data: " "
1034598-1034666 uart: rx-data: "t"
1034685-1034753 uart: rx-data: "h"
1034771-1034839 uart: rx-data: "r"
1034858-1034926 uart: rx-data: "e"
1034944-1035012 uart: rx-data: "a"
1035030-1035098 uart: rx-data: "d"
1035117-1035185 uart: rx-data: ":"
1035203-1035271 uart: rx-data: " "
1035290-1035358 uart: rx-data: "B"
1035376-1035444 uart: rx-data: "y"
1035463-1035531 uart: rx-data: "e"
1035549-1035617 uart: rx-data: " "
1035635-1035703 uart: rx-data: "B"
1035722-1035790 uart: rx-data: "y"
1035808-1035876 uart: rx-data: "e"
1035895-1035963 uart: rx-data: "!"
1035981-1036049 uart: rx-data: "[0D]"
1036068-1036136 uart: rx-data: "[0A]"
1036154-1036222 uart: rx-data: "[00]"
2422083-2422151 uart: rx-data: "I"
2422169-2422237 uart: rx-data: "N"
2422255-2422323 uart: rx-data: "P"
2422341-2422409 uart: rx-data: "U"
2422427-2422495 uart: rx-data: "T"
2422513-2422581 uart: rx-data: "_"
2422600-2422668 uart: rx-data: "S"
2422686-2422754 uart: rx-data: "E"
2422772-2422840 uart: rx-data: "T"
2422858-2422926 uart: rx-data: "_"
2422944-2423012 uart: rx-data: "R"
2423030-2423098 uart: rx-data: "E"
2423116-2423184 uart: rx-data: "P"
2423202-2423270 uart: rx-data: "_"
2423288-2423356 uart: rx-data: "P"
2423374-2423442 uart: rx-data: "E"
2423460-2423528 uart: rx-data: "R"
2423546-2423614 uart: rx-data: "I"
2423633-2423701 uart: rx-data: "O"
2423719-2423787 uart: rx-data: "D"
2423805-2423873 uart: rx-data: " "
2423891-2423959 uart: rx-data: "f"
2423977-2424045 uart: rx-data: "a"
2424063-2424131 uart: rx-data: "i"
2424149-2424217 uart: rx-data: "l"
2424235-2424303 uart: rx-data: "e"
2424321-2424389 uart: rx-data: "d"
2424407-2424475 uart: rx-data: "[0D]"
2424493-2424561 uart: rx-data: "[0A]"
2424579-2424647 uart: rx-data: "[00]"
