3670527-3670527 i2c: start: "Start" "S"
3671478-3671600 i2c: bit: "0"
3671356-3671478 i2c: bit: "0"
3671234-3671356 i2c: bit: "0"
3671112-3671234 i2c: bit: "0"
3670989-3671112 i2c: bit: "0"
3670867-3670989 i2c: bit: "1"
3670745-3670867 i2c: bit: "0"
3670623-3670745 i2c: bit: "1"
3671478-3671600 i2c: address-write: "Write" "Wr" "W"
3670623-3671478 i2c: address-write: "Address write: 50" "AW: 50" "50"
3671600-3671722 i2c: ack: "ACK" "A"
3672577-3672699 i2c: bit: "1"
3672455-3672577 i2c: bit: "1"
3672333-3672455 i2c: bit: "0"
3672211-3672333 i2c: bit: "1"
3672089-3672211 i2c: bit: "1"
3671966-3672089 i2c: bit: "0"
3671844-3671966 i2c: bit: "0"
3671722-3671844 i2c: bit: "0"
3671722-3672699 i2c: data-write: "Data write: 1B" "DW: 1B" "1B"
3672699-3672821 i2c: ack: "ACK" "A"
3672881-3672881 i2c: repeat-start: "Start repeat" "Sr"
3673826-3673948 i2c: bit: "1"
3673704-3673826 i2c: bit: "0"
3673582-3673704 i2c: bit: "0"
3673460-3673582 i2c: bit: "0"
3673338-3673460 i2c: bit: "0"
3673216-3673338 i2c: bit: "1"
3673093-3673216 i2c: bit: "0"
3672971-3673093 i2c: bit: "1"
3673826-3673948 i2c: address-read: "Read" "Rd" "R"
3672971-3673826 i2c: address-read: "Address read: 50" "AR: 50" "50"
3673948-3674070 i2c: ack: "ACK" "A"
3674925-3675047 i2c: bit: "0"
3674803-3674925 i2c: bit: "0"
3674681-3674803 i2c: bit: "0"
3674559-3674681 i2c: bit: "0"
3674437-3674559 i2c: bit: "1"
3674315-3674437 i2c: bit: "0"
3674193-3674315 i2c: bit: "1"
3674070-3674193 i2c: bit: "0"
3674070-3675047 i2c: data-read: "Data read: 50" "DR: 50" "50"
3675081-3675203 i2c: nack: "NACK" "N"
3675231-3675231 i2c: stop: "Stop" "P"
3675596-3675596 i2c: start: "Start" "S"
3676546-3676668 i2c: bit: "0"
3676424-3676546 i2c: bit: "0"
3676302-3676424 i2c: bit: "0"
3676180-3676302 i2c: bit: "0"
3676058-3676180 i2c: bit: "0"
3675936-3676058 i2c: bit: "1"
3675814-3675936 i2c: bit: "0"
3675691-3675814 i2c: bit: "1"
3676546-3676668 i2c: address-write: "Write" "Wr" "W"
3675691-3676546 i2c: address-write: "Address write: 50" "AW: 50" "50"
3676669-3676791 i2c: ack: "ACK" "A"
3677646-3677768 i2c: bit: "0"
3677524-3677646 i2c: bit: "1"
3677401-3677524 i2c: bit: "1"
3677279-3677401 i2c: bit: "1"
3677157-3677279 i2c: bit: "1"
3677035-3677157 i2c: bit: "0"
3676913-3677035 i2c: bit: "0"
3676791-3676913 i2c: bit: "0"
3676791-3677768 i2c: data-write: "Data write: 1E" "DW: 1E" "1E"
3677768-3677890 i2c: ack: "ACK" "A"
3677950-3677950 i2c: repeat-start: "Start repeat" "Sr"
3678895-3679017 i2c: bit: "1"
3678773-3678895 i2c: bit: "0"
3678650-3678773 i2c: bit: "0"
3678528-3678650 i2c: bit: "0"
3678406-3678528 i2c: bit: "0"
3678284-3678406 i2c: bit: "1"
3678162-3678284 i2c: bit: "0"
3678040-3678162 i2c: bit: "1"
3678895-3679017 i2c: address-read: "Read" "Rd" "R"
3678040-3678895 i2c: address-read: "Address read: 50" "AR: 50" "50"
3679017-3679139 i2c: ack: "ACK" "A"
3679994-3680116 i2c: bit: "1"
3679872-3679994 i2c: bit: "0"
3679750-3679872 i2c: bit: "1"
3679628-3679750 i2c: bit: "1"
3679505-3679628 i2c: bit: "0"
3679383-3679505 i2c: bit: "1"
3679261-3679383 i2c: bit: "0"
3679139-3679261 i2c: bit: "0"
3679139-3680116 i2c: data-read: "Data read: 2D" "DR: 2D" "2D"
3680149-3680271 i2c: nack: "NACK" "N"
3680299-3680299 i2c: stop: "Stop" "P"
3680665-3680665 i2c: start: "Start" "S"
3681615-3681737 i2c: bit: "0"
3681493-3681615 i2c: bit: "0"
3681371-3681493 i2c: bit: "0"
3681249-3681371 i2c: bit: "0"
3681126-3681249 i2c: bit: "0"
3681004-3681126 i2c: bit: "1"
3680882-3681004 i2c: bit: "0"
3680760-3680882 i2c: bit: "1"
3681615-3681737 i2c: address-write: "Write" "Wr" "W"
3680760-3681615 i2c: address-write: "Address write: 50" "AW: 50" "50"
3681737-3681859 i2c: ack: "ACK" "A"
3682714-3682836 i2c: bit: "1"
3682592-3682714 i2c: bit: "0"
3682470-3682592 i2c: bit: "1"
3682348-3682470 i2c: bit: "1"
3682226-3682348 i2c: bit: "1"
3682103-3682226 i2c: bit: "0"
3681981-3682103 i2c: bit: "0"
3681859-3681981 i2c: bit: "0"
3681859-3682836 i2c: data-write: "Data write: 1D" "DW: 1D" "1D"
3682836-3682958 i2c: ack: "ACK" "A"
3683018-3683018 i2c: repeat-start: "Start repeat" "Sr"
3683963-3684085 i2c: bit: "1"
3683841-3683963 i2c: bit: "0"
3683719-3683841 i2c: bit: "0"
3683597-3683719 i2c: bit: "0"
3683475-3683597 i2c: bit: "0"
3683353-3683475 i2c: bit: "1"
3683230-3683353 i2c: bit: "0"
3683108-3683230 i2c: bit: "1"
3683963-3684085 i2c: address-read: "Read" "Rd" "R"
3683108-3683963 i2c: address-read: "Address read: 50" "AR: 50" "50"
3684085-3684207 i2c: ack: "ACK" "A"
3685062-3685184 i2c: bit: "0"
3684940-3685062 i2c: bit: "0"
3684818-3684940 i2c: bit: "0"
3684696-3684818 i2c: bit: "0"
3684574-3684696 i2c: bit: "1"
3684452-3684574 i2c: bit: "0"
3684330-3684452 i2c: bit: "1"
3684208-3684330 i2c: bit: "0"
3684208-3685184 i2c: data-read: "Data read: 50" "DR: 50" "50"
3685218-3685340 i2c: nack: "NACK" "N"
3685368-3685368 i2c: stop: "Stop" "P"
3700267-3700267 i2c: start: "Start" "S"
3701217-3701339 i2c: bit: "0"
3701095-3701217 i2c: bit: "1"
3700973-3701095 i2c: bit: "0"
3700851-3700973 i2c: bit: "0"
3700729-3700851 i2c: bit: "1"
3700607-3700729 i2c: bit: "0"
3700485-3700607 i2c: bit: "1"
3700363-3700485 i2c: bit: "1"
3701217-3701339 i2c: address-write: "Write" "Wr" "W"
3700363-3701217 i2c: address-write: "Address write: 69" "AW: 69" "69"
3701340-3701462 i2c: ack: "ACK" "A"
3702317-3702440 i2c: bit: "0"
3702194-3702317 i2c: bit: "0"
3702072-3702194 i2c: bit: "0"
3701950-3702072 i2c: bit: "0"
3701828-3701950 i2c: bit: "0"
3701706-3701828 i2c: bit: "0"
3701584-3701706 i2c: bit: "0"
3701462-3701584 i2c: bit: "0"
3701462-3702440 i2c: data-write: "Data write: 00" "DW: 00" "00"
3702439-3702562 i2c: ack: "ACK" "A"
3702621-3702621 i2c: repeat-start: "Start repeat" "Sr"
3703566-3703688 i2c: bit: "1"
3703444-3703566 i2c: bit: "1"
3703321-3703444 i2c: bit: "0"
3703199-3703321 i2c: bit: "0"
3703077-3703199 i2c: bit: "1"
3702955-3703077 i2c: bit: "0"
3702833-3702955 i2c: bit: "1"
3702711-3702833 i2c: bit: "1"
3703566-3703688 i2c: address-read: "Read" "Rd" "R"
3702711-3703566 i2c: address-read: "Address read: 69" "AR: 69" "69"
3703688-3703810 i2c: ack: "ACK" "A"
3704665-3704787 i2c: bit: "1"
3704543-3704665 i2c: bit: "1"
3704421-3704543 i2c: bit: "1"
3704298-3704421 i2c: bit: "1"
3704176-3704298 i2c: bit: "0"
3704054-3704176 i2c: bit: "0"
3703932-3704054 i2c: bit: "0"
3703810-3703932 i2c: bit: "0"
3703810-3704787 i2c: data-read: "Data read: 0F" "DR: 0F" "0F"
3704787-3704909 i2c: ack: "ACK" "A"
3705764-3705886 i2c: bit: "0"
3705642-3705764 i2c: bit: "1"
3705520-3705642 i2c: bit: "1"
3705398-3705520 i2c: bit: "0"
3705276-3705398 i2c: bit: "0"
3705153-3705276 i2c: bit: "0"
3705031-3705153 i2c: bit: "0"
3704909-3705031 i2c: bit: "0"
3704909-3705886 i2c: data-read: "Data read: 06" "DR: 06" "06"
3705886-3706008 i2c: ack: "ACK" "A"
3706863-3706985 i2c: bit: "1"
3706741-3706863 i2c: bit: "1"
3706619-3706741 i2c: bit: "1"
3706497-3706619 i2c: bit: "1"
3706375-3706497 i2c: bit: "1"
3706253-3706375 i2c: bit: "1"
3706130-3706253 i2c: bit: "1"
3706008-3706130 i2c: bit: "1"
3706008-3706985 i2c: data-read: "Data read: FF" "DR: FF" "FF"
3706985-3707107 i2c: ack: "ACK" "A"
3707962-3708084 i2c: bit: "1"
3707840-3707962 i2c: bit: "1"
3707718-3707840 i2c: bit: "1"
3707596-3707718 i2c: bit: "1"
3707474-3707596 i2c: bit: "1"
3707352-3707474 i2c: bit: "1"
3707230-3707352 i2c: bit: "1"
3707108-3707230 i2c: bit: "1"
3707108-3708084 i2c: data-read: "Data read: FF" "DR: FF" "FF"
3708085-3708207 i2c: ack: "ACK" "A"
3709062-3709184 i2c: bit: "1"
3708940-3709062 i2c: bit: "1"
3708817-3708940 i2c: bit: "1"
3708695-3708817 i2c: bit: "1"
3708573-3708695 i2c: bit: "1"
3708451-3708573 i2c: bit: "1"
3708329-3708451 i2c: bit: "1"
3708207-3708329 i2c: bit: "1"
3708207-3709184 i2c: data-read: "Data read: FF" "DR: FF" "FF"
3709184-3709306 i2c: ack: "ACK" "A"
3710161-3710283 i2c: bit: "1"
3710039-3710161 i2c: bit: "1"
3709917-3710039 i2c: bit: "1"
3709794-3709917 i2c: bit: "1"
3709672-3709794 i2c: bit: "1"
3709550-3709672 i2c: bit: "1"
3709428-3709550 i2c: bit: "1"
3709306-3709428 i2c: bit: "1"
3709306-3710283 i2c: data-read: "Data read: FF" "DR: FF" "FF"
3710283-3710405 i2c: ack: "ACK" "A"
3711260-3711382 i2c: bit: "1"
3711138-3711260 i2c: bit: "1"
3711016-3711138 i2c: bit: "1"
3710894-3711016 i2c: bit: "1"
3710772-3710894 i2c: bit: "1"
3710649-3710772 i2c: bit: "1"
3710527-3710649 i2c: bit: "1"
3710405-3710527 i2c: bit: "1"
3710405-3711382 i2c: data-read: "Data read: FF" "DR: FF" "FF"
3711382-3711504 i2c: ack: "ACK" "A"
3712359-3712481 i2c: bit: "1"
3712237-3712359 i2c: bit: "0"
3712115-3712237 i2c: bit: "0"
3711993-3712115 i2c: bit: "0"
3711871-3711993 i2c: bit: "1"
3711749-3711871 i2c: bit: "0"
3711626-3711749 i2c: bit: "1"
3711504-3711626 i2c: bit: "0"
3711504-3712481 i2c: data-read: "Data read: 51" "DR: 51" "51"
3712481-3712603 i2c: ack: "ACK" "A"
3713458-3713580 i2c: bit: "0"
3713336-3713458 i2c: bit: "1"
3713214-3713336 i2c: bit: "1"
3713092-3713214 i2c: bit: "0"
3712970-3713092 i2c: bit: "0"
3712848-3712970 i2c: bit: "0"
3712726-3712848 i2c: bit: "0"
3712604-3712726 i2c: bit: "1"
3712604-3713580 i2c: data-read: "Data read: 86" "DR: 86" "86"
3713581-3713703 i2c: ack: "ACK" "A"
3714558-3714680 i2c: bit: "1"
3714436-3714558 i2c: bit: "1"
3714313-3714436 i2c: bit: "1"
3714191-3714313 i2c: bit: "1"
3714069-3714191 i2c: bit: "0"
3713947-3714069 i2c: bit: "0"
3713825-3713947 i2c: bit: "0"
3713703-3713825 i2c: bit: "0"
3713703-3714680 i2c: data-read: "Data read: 0F" "DR: 0F" "0F"
3714680-3714802 i2c: ack: "ACK" "A"
3715657-3715779 i2c: bit: "0"
3715535-3715657 i2c: bit: "0"
3715413-3715535 i2c: bit: "0"
3715290-3715413 i2c: bit: "1"
3715168-3715290 i2c: bit: "0"
3715046-3715168 i2c: bit: "0"
3714924-3715046 i2c: bit: "0"
3714802-3714924 i2c: bit: "0"
3714802-3715779 i2c: data-read: "Data read: 08" "DR: 08" "08"
3715779-3715901 i2c: ack: "ACK" "A"
3716756-3716878 i2c: bit: "1"
3716634-3716756 i2c: bit: "0"
3716512-3716634 i2c: bit: "0"
3716390-3716512 i2c: bit: "0"
3716268-3716390 i2c: bit: "0"
3716145-3716268 i2c: bit: "0"
3716023-3716145 i2c: bit: "0"
3715901-3716023 i2c: bit: "0"
3715901-3716878 i2c: data-read: "Data read: 01" "DR: 01" "01"
3716878-3717000 i2c: ack: "ACK" "A"
3717855-3717977 i2c: bit: "0"
3717733-3717855 i2c: bit: "0"
3717611-3717733 i2c: bit: "0"
3717489-3717611 i2c: bit: "1"
3717367-3717489 i2c: bit: "0"
3717245-3717367 i2c: bit: "0"
3717122-3717245 i2c: bit: "0"
3717000-3717122 i2c: bit: "1"
3717000-3717977 i2c: data-read: "Data read: 88" "DR: 88" "88"
3717977-3718099 i2c: ack: "ACK" "A"
3718954-3719076 i2c: bit: "0"
3718832-3718954 i2c: bit: "1"
3718710-3718832 i2c: bit: "1"
3718588-3718710 i2c: bit: "1"
3718466-3718588 i2c: bit: "0"
3718344-3718466 i2c: bit: "0"
3718222-3718344 i2c: bit: "0"
3718100-3718222 i2c: bit: "0"
3718100-3719076 i2c: data-read: "Data read: 0E" "DR: 0E" "0E"
3719077-3719199 i2c: ack: "ACK" "A"
3720054-3720176 i2c: bit: "1"
3719932-3720054 i2c: bit: "0"
3719809-3719932 i2c: bit: "1"
3719687-3719809 i2c: bit: "0"
3719565-3719687 i2c: bit: "0"
3719443-3719565 i2c: bit: "1"
3719321-3719443 i2c: bit: "1"
3719199-3719321 i2c: bit: "1"
3719199-3720176 i2c: data-read: "Data read: E5" "DR: E5" "E5"
3720176-3720298 i2c: ack: "ACK" "A"
3721153-3721275 i2c: bit: "1"
3721031-3721153 i2c: bit: "1"
3720909-3721031 i2c: bit: "1"
3720786-3720909 i2c: bit: "0"
3720664-3720786 i2c: bit: "1"
3720542-3720664 i2c: bit: "1"
3720420-3720542 i2c: bit: "1"
3720298-3720420 i2c: bit: "1"
3720298-3721275 i2c: data-read: "Data read: F7" "DR: F7" "F7"
3721308-3721430 i2c: nack: "NACK" "N"
3721458-3721458 i2c: stop: "Stop" "P"
3825148-3825148 i2c: start: "Start" "S"
3826099-3826221 i2c: bit: "0"
3825977-3826099 i2c: bit: "1"
3825854-3825977 i2c: bit: "0"
3825732-3825854 i2c: bit: "0"
3825610-3825732 i2c: bit: "1"
3825488-3825610 i2c: bit: "0"
3825366-3825488 i2c: bit: "1"
3825244-3825366 i2c: bit: "1"
3826099-3826221 i2c: address-write: "Write" "Wr" "W"
3825244-3826099 i2c: address-write: "Address write: 69" "AW: 69" "69"
3826221-3826343 i2c: ack: "ACK" "A"
3827198-3827320 i2c: bit: "0"
3827076-3827198 i2c: bit: "0"
3826954-3827076 i2c: bit: "0"
3826832-3826954 i2c: bit: "0"
3826709-3826832 i2c: bit: "0"
3826587-3826709 i2c: bit: "0"
3826465-3826587 i2c: bit: "0"
3826343-3826465 i2c: bit: "0"
3826343-3827320 i2c: data-write: "Data write: 00" "DW: 00" "00"
3827320-3827442 i2c: ack: "ACK" "A"
3828297-3828419 i2c: bit: "0"
3828175-3828297 i2c: bit: "0"
3828053-3828175 i2c: bit: "0"
3827931-3828053 i2c: bit: "1"
3827809-3827931 i2c: bit: "1"
3827686-3827809 i2c: bit: "0"
3827564-3827686 i2c: bit: "0"
3827442-3827564 i2c: bit: "0"
3827442-3828419 i2c: data-write: "Data write: 18" "DW: 18" "18"
3828419-3828541 i2c: ack: "ACK" "A"
3829396-3829518 i2c: bit: "0"
3829274-3829396 i2c: bit: "1"
3829152-3829274 i2c: bit: "1"
3829030-3829152 i2c: bit: "1"
3828908-3829030 i2c: bit: "0"
3828786-3828908 i2c: bit: "1"
3828664-3828786 i2c: bit: "0"
3828541-3828664 i2c: bit: "1"
3828541-3829518 i2c: data-write: "Data write: AE" "DW: AE" "AE"
3829518-3829640 i2c: ack: "ACK" "A"
3830496-3830619 i2c: bit: "1"
3830373-3830496 i2c: bit: "1"
3830251-3830373 i2c: bit: "1"
3830129-3830251 i2c: bit: "1"
3830007-3830129 i2c: bit: "1"
3829885-3830007 i2c: bit: "1"
3829763-3829885 i2c: bit: "1"
3829641-3829763 i2c: bit: "1"
3829641-3830619 i2c: data-write: "Data write: FF" "DW: FF" "FF"
3830618-3830741 i2c: ack: "ACK" "A"
3831595-3831717 i2c: bit: "1"
3831473-3831595 i2c: bit: "1"
3831350-3831473 i2c: bit: "1"
3831228-3831350 i2c: bit: "1"
3831106-3831228 i2c: bit: "0"
3830984-3831106 i2c: bit: "1"
3830862-3830984 i2c: bit: "1"
3830740-3830862 i2c: bit: "1"
3830740-3831717 i2c: data-write: "Data write: EF" "DW: EF" "EF"
3831717-3831839 i2c: ack: "ACK" "A"
3832694-3832816 i2c: bit: "1"
3832572-3832694 i2c: bit: "1"
3832450-3832572 i2c: bit: "0"
3832328-3832450 i2c: bit: "1"
3832205-3832328 i2c: bit: "1"
3832083-3832205 i2c: bit: "1"
3831961-3832083 i2c: bit: "1"
3831839-3831961 i2c: bit: "1"
3831839-3832816 i2c: data-write: "Data write: FB" "DW: FB" "FB"
3832816-3832938 i2c: ack: "ACK" "A"
3833793-3833915 i2c: bit: "1"
3833671-3833793 i2c: bit: "1"
3833549-3833671 i2c: bit: "1"
3833427-3833549 i2c: bit: "1"
3833305-3833427 i2c: bit: "0"
3833182-3833305 i2c: bit: "0"
3833060-3833182 i2c: bit: "0"
3832938-3833060 i2c: bit: "0"
3832938-3833915 i2c: data-write: "Data write: 0F" "DW: 0F" "0F"
3833915-3834037 i2c: ack: "ACK" "A"
3834892-3835014 i2c: bit: "0"
3834770-3834892 i2c: bit: "0"
3834648-3834770 i2c: bit: "0"
3834526-3834648 i2c: bit: "0"
3834404-3834526 i2c: bit: "0"
3834282-3834404 i2c: bit: "0"
3834160-3834282 i2c: bit: "1"
3834037-3834160 i2c: bit: "1"
3834037-3835014 i2c: data-write: "Data write: C0" "DW: C0" "C0"
3835014-3835136 i2c: ack: "ACK" "A"
3835992-3836115 i2c: bit: "1"
3835869-3835992 i2c: bit: "0"
3835747-3835869 i2c: bit: "0"
3835625-3835747 i2c: bit: "0"
3835503-3835625 i2c: bit: "1"
3835381-3835503 i2c: bit: "1"
3835259-3835381 i2c: bit: "1"
3835137-3835259 i2c: bit: "1"
3835137-3836115 i2c: data-write: "Data write: F1" "DW: F1" "F1"
3836114-3836237 i2c: ack: "ACK" "A"
3837091-3837213 i2c: bit: "1"
3836969-3837091 i2c: bit: "1"
3836846-3836969 i2c: bit: "1"
3836724-3836846 i2c: bit: "0"
3836602-3836724 i2c: bit: "1"
3836480-3836602 i2c: bit: "0"
3836358-3836480 i2c: bit: "0"
3836236-3836358 i2c: bit: "0"
3836236-3837213 i2c: data-write: "Data write: 17" "DW: 17" "17"
3837213-3837335 i2c: ack: "ACK" "A"
3838190-3838312 i2c: bit: "0"
3838068-3838190 i2c: bit: "0"
3837946-3838068 i2c: bit: "0"
3837824-3837946 i2c: bit: "1"
3837701-3837824 i2c: bit: "1"
3837579-3837701 i2c: bit: "0"
3837457-3837579 i2c: bit: "0"
3837335-3837457 i2c: bit: "0"
3837335-3838312 i2c: data-write: "Data write: 18" "DW: 18" "18"
3838312-3838434 i2c: ack: "ACK" "A"
3839289-3839411 i2c: bit: "0"
3839167-3839289 i2c: bit: "0"
3839045-3839167 i2c: bit: "0"
3838923-3839045 i2c: bit: "0"
3838801-3838923 i2c: bit: "1"
3838678-3838801 i2c: bit: "0"
3838556-3838678 i2c: bit: "0"
3838434-3838556 i2c: bit: "0"
3838434-3839411 i2c: data-write: "Data write: 10" "DW: 10" "10"
3839411-3839533 i2c: ack: "ACK" "A"
3840388-3840510 i2c: bit: "0"
3840266-3840388 i2c: bit: "1"
3840144-3840266 i2c: bit: "0"
3840022-3840144 i2c: bit: "1"
3839900-3840022 i2c: bit: "1"
3839778-3839900 i2c: bit: "1"
3839656-3839778 i2c: bit: "1"
3839533-3839656 i2c: bit: "0"
3839533-3840510 i2c: data-write: "Data write: 7A" "DW: 7A" "7A"
3840510-3840632 i2c: ack: "ACK" "A"
3841488-3841611 i2c: bit: "0"
3841365-3841488 i2c: bit: "0"
3841243-3841365 i2c: bit: "1"
3841121-3841243 i2c: bit: "1"
3840999-3841121 i2c: bit: "0"
3840877-3840999 i2c: bit: "0"
3840755-3840877 i2c: bit: "0"
3840633-3840755 i2c: bit: "1"
3840633-3841611 i2c: data-write: "Data write: 8C" "DW: 8C" "8C"
3841610-3841733 i2c: ack: "ACK" "A"
3842587-3842709 i2c: bit: "1"
3842465-3842587 i2c: bit: "0"
3842342-3842465 i2c: bit: "0"
3842220-3842342 i2c: bit: "0"
3842098-3842220 i2c: bit: "0"
3841976-3842098 i2c: bit: "0"
3841854-3841976 i2c: bit: "0"
3841732-3841854 i2c: bit: "1"
3841732-3842709 i2c: data-write: "Data write: 81" "DW: 81" "81"
3842709-3842831 i2c: ack: "ACK" "A"
3843686-3843808 i2c: bit: "1"
3843564-3843686 i2c: bit: "1"
3843442-3843564 i2c: bit: "1"
3843320-3843442 i2c: bit: "1"
3843197-3843320 i2c: bit: "1"
3843075-3843197 i2c: bit: "0"
3842953-3843075 i2c: bit: "0"
3842831-3842953 i2c: bit: "0"
3842831-3843808 i2c: data-write: "Data write: 1F" "DW: 1F" "1F"
3843808-3843930 i2c: ack: "ACK" "A"
3844785-3844907 i2c: bit: "0"
3844663-3844785 i2c: bit: "0"
3844541-3844663 i2c: bit: "0"
3844419-3844541 i2c: bit: "1"
3844297-3844419 i2c: bit: "1"
3844174-3844297 i2c: bit: "0"
3844052-3844174 i2c: bit: "0"
3843930-3844052 i2c: bit: "0"
3843930-3844907 i2c: data-write: "Data write: 18" "DW: 18" "18"
3844907-3845029 i2c: ack: "ACK" "A"
3845884-3846006 i2c: bit: "0"
3845762-3845884 i2c: bit: "0"
3845640-3845762 i2c: bit: "0"
3845518-3845640 i2c: bit: "0"
3845396-3845518 i2c: bit: "0"
3845274-3845396 i2c: bit: "0"
3845152-3845274 i2c: bit: "0"
3845029-3845152 i2c: bit: "0"
3845029-3846006 i2c: data-write: "Data write: 00" "DW: 00" "00"
3846006-3846128 i2c: ack: "ACK" "A"
3846984-3847107 i2c: bit: "0"
3846861-3846984 i2c: bit: "0"
3846739-3846861 i2c: bit: "0"
3846617-3846739 i2c: bit: "0"
3846495-3846617 i2c: bit: "0"
3846373-3846495 i2c: bit: "0"
3846251-3846373 i2c: bit: "0"
3846129-3846251 i2c: bit: "0"
3846129-3847107 i2c: data-write: "Data write: 00" "DW: 00" "00"
3847106-3847229 i2c: ack: "ACK" "A"
3848083-3848205 i2c: bit: "0"
3847961-3848083 i2c: bit: "0"
3847838-3847961 i2c: bit: "0"
3847716-3847838 i2c: bit: "0"
3847594-3847716 i2c: bit: "0"
3847472-3847594 i2c: bit: "0"
3847350-3847472 i2c: bit: "0"
3847228-3847350 i2c: bit: "0"
3847228-3848205 i2c: data-write: "Data write: 00" "DW: 00" "00"
3848205-3848327 i2c: ack: "ACK" "A"
3849182-3849304 i2c: bit: "0"
3849060-3849182 i2c: bit: "0"
3848938-3849060 i2c: bit: "0"
3848816-3848938 i2c: bit: "0"
3848693-3848816 i2c: bit: "0"
3848571-3848693 i2c: bit: "0"
3848449-3848571 i2c: bit: "0"
3848327-3848449 i2c: bit: "0"
3848327-3849304 i2c: data-write: "Data write: 00" "DW: 00" "00"
3849304-3849426 i2c: ack: "ACK" "A"
3850281-3850403 i2c: bit: "0"
3850159-3850281 i2c: bit: "0"
3850037-3850159 i2c: bit: "0"
3849915-3850037 i2c: bit: "0"
3849793-3849915 i2c: bit: "0"
3849670-3849793 i2c: bit: "0"
3849548-3849670 i2c: bit: "0"
3849426-3849548 i2c: bit: "0"
3849426-3850403 i2c: data-write: "Data write: 00" "DW: 00" "00"
3850403-3850525 i2c: ack: "ACK" "A"
3851380-3851502 i2c: bit: "0"
3851258-3851380 i2c: bit: "0"
3851136-3851258 i2c: bit: "0"
3851014-3851136 i2c: bit: "0"
3850892-3851014 i2c: bit: "0"
3850770-3850892 i2c: bit: "0"
3850648-3850770 i2c: bit: "0"
3850525-3850648 i2c: bit: "0"
3850525-3851502 i2c: data-write: "Data write: 00" "DW: 00" "00"
3851502-3851624 i2c: ack: "ACK" "A"
3852480-3852603 i2c: bit: "0"
3852357-3852480 i2c: bit: "0"
3852235-3852357 i2c: bit: "0"
3852113-3852235 i2c: bit: "0"
3851991-3852113 i2c: bit: "0"
3851869-3851991 i2c: bit: "0"
3851747-3851869 i2c: bit: "0"
3851625-3851747 i2c: bit: "0"
3851625-3852603 i2c: data-write: "Data write: 00" "DW: 00" "00"
3852602-3852725 i2c: ack: "ACK" "A"
3853579-3853701 i2c: bit: "0"
3853457-3853579 i2c: bit: "0"
3853334-3853457 i2c: bit: "0"
3853212-3853334 i2c: bit: "0"
3853090-3853212 i2c: bit: "0"
3852968-3853090 i2c: bit: "0"
3852846-3852968 i2c: bit: "0"
3852724-3852846 i2c: bit: "0"
3852724-3853701 i2c: data-write: "Data write: 00" "DW: 00" "00"
3853701-3853823 i2c: ack: "ACK" "A"
3854678-3854800 i2c: bit: "0"
3854556-3854678 i2c: bit: "0"
3854434-3854556 i2c: bit: "0"
3854312-3854434 i2c: bit: "0"
3854189-3854312 i2c: bit: "0"
3854067-3854189 i2c: bit: "0"
3853945-3854067 i2c: bit: "0"
3853823-3853945 i2c: bit: "0"
3853823-3854800 i2c: data-write: "Data write: 00" "DW: 00" "00"
3854800-3854922 i2c: ack: "ACK" "A"
3854950-3854950 i2c: stop: "Stop" "P"
