0-0 i2c: start: "Start" "S"
1-16 i2c: address-write: "Address write: 68" "AW: 68" "68"
18-18 i2c: ack: "ACK" "A"
24-39 i2c: data-write: "Data write: 00" "DW: 00" "00"
41-41 i2c: ack: "ACK" "A"
42-57 i2c: data-write: "Data write: 30" "DW: 30" "30"
59-59 i2c: ack: "ACK" "A"
60-75 i2c: data-write: "Data write: 35" "DW: 35" "35"
77-77 i2c: ack: "ACK" "A"
78-93 i2c: data-write: "Data write: 23" "DW: 23" "23"
95-95 i2c: ack: "ACK" "A"
96-111 i2c: data-write: "Data write: 01" "DW: 01" "01"
113-113 i2c: ack: "ACK" "A"
114-129 i2c: data-write: "Data write: 10" "DW: 10" "10"
131-131 i2c: ack: "ACK" "A"
132-147 i2c: data-write: "Data write: 03" "DW: 03" "03"
149-149 i2c: ack: "ACK" "A"
150-165 i2c: data-write: "Data write: 13" "DW: 13" "13"
167-167 i2c: ack: "ACK" "A"
171-171 i2c: stop: "Stop" "P"
253-253 i2c: start: "Start" "S"
254-269 i2c: address-write: "Address write: 68" "AW: 68" "68"
271-271 i2c: ack: "ACK" "A"
272-287 i2c: data-write: "Data write: 00" "DW: 00" "00"
289-289 i2c: ack: "ACK" "A"
323-323 i2c: repeat-start: "Start repeat" "Sr"
324-339 i2c: address-read: "Address read: 68" "AR: 68" "68"
341-341 i2c: ack: "ACK" "A"
342-357 i2c: data-read: "Data read: 30" "DR: 30" "30"
359-359 i2c: ack: "ACK" "A"
360-375 i2c: data-read: "Data read: 35" "DR: 35" "35"
377-377 i2c: ack: "ACK" "A"
378-393 i2c: data-read: "Data read: 23" "DR: 23" "23"
395-395 i2c: ack: "ACK" "A"
396-411 i2c: data-read: "Data read: 01" "DR: 01" "01"
413-413 i2c: ack: "ACK" "A"
414-429 i2c: data-read: "Data read: 10" "DR: 10" "10"
431-431 i2c: ack: "ACK" "A"
432-447 i2c: data-read: "Data read: 03" "DR: 03" "03"
449-449 i2c: ack: "ACK" "A"
450-465 i2c: data-read: "Data read: 13" "DR: 13" "13"
467-467 i2c: nack: "NACK" "N"
471-471 i2c: stop: "Stop" "P"
3548-3548 i2c: start: "Start" "S"
3549-3564 i2c: address-write: "Address write: 68" "AW: 68" "68"
3566-3566 i2c: ack: "ACK" "A"
3567-3582 i2c: data-write: "Data write: 00" "DW: 00" "00"
3584-3584 i2c: ack: "ACK" "A"
3608-3608 i2c: repeat-start: "Start repeat" "Sr"
3609-3624 i2c: address-read: "Address read: 68" "AR: 68" "68"
3626-3626 i2c: ack: "ACK" "A"
3627-3642 i2c: data-read: "Data read: 30" "DR: 30" "30"
3644-3644 i2c: ack: "ACK" "A"
3645-3660 i2c: data-read: "Data read: 35" "DR: 35" "35"
3662-3662 i2c: ack: "ACK" "A"
3663-3678 i2c: data-read: "Data read: 23" "DR: 23" "23"
3680-3680 i2c: ack: "ACK" "A"
3681-3696 i2c: data-read: "Data read: 01" "DR: 01" "01"
3698-3698 i2c: ack: "ACK" "A"
3699-3714 i2c: data-read: "Data read: 10" "DR: 10" "10"
3716-3716 i2c: ack: "ACK" "A"
3717-3732 i2c: data-read: "Data read: 03" "DR: 03" "03"
3734-3734 i2c: ack: "ACK" "A"
3735-3750 i2c: data-read: "Data read: 13" "DR: 13" "13"
3752-3752 i2c: nack: "NACK" "N"
3756-3756 i2c: stop: "Stop" "P"
7470-7470 i2c: start: "Start" "S"
7471-7486 i2c: address-write: "Address write: 68" "AW: 68" "68"
7488-7488 i2c: ack: "ACK" "A"
7489-7504 i2c: data-write: "Data write: 00" "DW: 00" "00"
7506-7506 i2c: ack: "ACK" "A"
7529-7529 i2c: repeat-start: "Start repeat" "Sr"
7530-7545 i2c: address-read: "Address read: 68" "AR: 68" "68"
7547-7547 i2c: ack: "ACK" "A"
7548-7563 i2c: data-read: "Data read: 30" "DR: 30" "30"
7565-7565 i2c: ack: "ACK" "A"
7566-7581 i2c: data-read: "Data read: 35" "DR: 35" "35"
7583-7583 i2c: ack: "ACK" "A"
7584-7599 i2c: data-read: "Data read: 23" "DR: 23" "23"
7601-7601 i2c: ack: "ACK" "A"
7602-7617 i2c: data-read: "Data read: 01" "DR: 01" "01"
7619-7619 i2c: ack: "ACK" "A"
7620-7635 i2c: data-read: "Data read: 10" "DR: 10" "10"
7637-7637 i2c: ack: "ACK" "A"
7638-7653 i2c: data-read: "Data read: 03" "DR: 03" "03"
7655-7655 i2c: ack: "ACK" "A"
7656-7671 i2c: data-read: "Data read: 13" "DR: 13" "13"
7673-7673 i2c: nack: "NACK" "N"
7677-7677 i2c: stop: "Stop" "P"
11405-11405 i2c: start: "Start" "S"
11407-11422 i2c: address-write: "Address write: 68" "AW: 68" "68"
11424-11424 i2c: ack: "ACK" "A"
11425-11440 i2c: data-write: "Data write: 00" "DW: 00" "00"
11442-11442 i2c: ack: "ACK" "A"
11466-11466 i2c: repeat-start: "Start repeat" "Sr"
11467-11482 i2c: address-read: "Address read: 68" "AR: 68" "68"
11484-11484 i2c: ack: "ACK" "A"
11485-11500 i2c: data-read: "Data read: 30" "DR: 30" "30"
11502-11502 i2c: ack: "ACK" "A"
11503-11518 i2c: data-read: "Data read: 35" "DR: 35" "35"
11520-11520 i2c: ack: "ACK" "A"
11521-11536 i2c: data-read: "Data read: 23" "DR: 23" "23"
11538-11538 i2c: ack: "ACK" "A"
11539-11554 i2c: data-read: "Data read: 01" "DR: 01" "01"
11556-11556 i2c: ack: "ACK" "A"
11557-11572 i2c: data-read: "Data read: 10" "DR: 10" "10"
11574-11574 i2c: ack: "ACK" "A"
11575-11590 i2c: data-read: "Data read: 03" "DR: 03" "03"
11592-11592 i2c: ack: "ACK" "A"
11593-11608 i2c: data-read: "Data read: 13" "DR: 13" "13"
11610-11610 i2c: nack: "NACK" "N"
11614-11614 i2c: stop: "Stop" "P"
15332-15332 i2c: start: "Start" "S"
15333-15348 i2c: address-write: "Address write: 68" "AW: 68" "68"
15350-15350 i2c: ack: "ACK" "A"
15351-15366 i2c: data-write: "Data write: 00" "DW: 00" "00"
15368-15368 i2c: ack: "ACK" "A"
15400-15400 i2c: repeat-start: "Start repeat" "Sr"
15401-15416 i2c: address-read: "Address read: 68" "AR: 68" "68"
15418-15418 i2c: ack: "ACK" "A"
15419-15434 i2c: data-read: "Data read: 30" "DR: 30" "30"
15436-15436 i2c: ack: "ACK" "A"
15437-15452 i2c: data-read: "Data read: 35" "DR: 35" "35"
15454-15454 i2c: ack: "ACK" "A"
15455-15470 i2c: data-read: "Data read: 23" "DR: 23" "23"
15472-15472 i2c: ack: "ACK" "A"
15473-15488 i2c: data-read: "Data read: 01" "DR: 01" "01"
15490-15490 i2c: ack: "ACK" "A"
15491-15506 i2c: data-read: "Data read: 10" "DR: 10" "10"
15508-15508 i2c: ack: "ACK" "A"
15509-15524 i2c: data-read: "Data read: 03" "DR: 03" "03"
15526-15526 i2c: ack: "ACK" "A"
15527-15542 i2c: data-read: "Data read: 13" "DR: 13" "13"
15544-15544 i2c: nack: "NACK" "N"
15548-15548 i2c: stop: "Stop" "P"
19253-19253 i2c: start: "Start" "S"
19254-19269 i2c: address-write: "Address write: 68" "AW: 68" "68"
19271-19271 i2c: ack: "ACK" "A"
19273-19288 i2c: data-write: "Data write: 00" "DW: 00" "00"
19290-19290 i2c: ack: "ACK" "A"
19359-19359 i2c: repeat-start: "Start repeat" "Sr"
19360-19375 i2c: address-read: "Address read: 68" "AR: 68" "68"
19377-19377 i2c: ack: "ACK" "A"
19378-19393 i2c: data-read: "Data read: 30" "DR: 30" "30"
19395-19395 i2c: ack: "ACK" "A"
19396-19411 i2c: data-read: "Data read: 35" "DR: 35" "35"
19413-19413 i2c: ack: "ACK" "A"
19414-19429 i2c: data-read: "Data read: 23" "DR: 23" "23"
19431-19431 i2c: ack: "ACK" "A"
19432-19447 i2c: data-read: "Data read: 01" "DR: 01" "01"
19449-19449 i2c: ack: "ACK" "A"
19450-19465 i2c: data-read: "Data read: 10" "DR: 10" "10"
19467-19467 i2c: ack: "ACK" "A"
19468-19483 i2c: data-read: "Data read: 03" "DR: 03" "03"
19485-19485 i2c: ack: "ACK" "A"
19486-19501 i2c: data-read: "Data read: 13" "DR: 13" "13"
19503-19503 i2c: nack: "NACK" "N"
19507-19507 i2c: stop: "Stop" "P"
23211-23211 i2c: start: "Start" "S"
23213-23228 i2c: address-write: "Address write: 68" "AW: 68" "68"
23230-23230 i2c: ack: "ACK" "A"
23264-23279 i2c: data-write: "Data write: 00" "DW: 00" "00"
23281-23281 i2c: ack: "ACK" "A"
23299-23299 i2c: repeat-start: "Start repeat" "Sr"
23300-23315 i2c: address-read: "Address read: 68" "AR: 68" "68"
23317-23317 i2c: ack: "ACK" "A"
23318-23333 i2c: data-read: "Data read: 30" "DR: 30" "30"
23335-23335 i2c: ack: "ACK" "A"
23336-23351 i2c: data-read: "Data read: 35" "DR: 35" "35"
23353-23353 i2c: ack: "ACK" "A"
23354-23369 i2c: data-read: "Data read: 23" "DR: 23" "23"
23371-23371 i2c: ack: "ACK" "A"
23372-23387 i2c: data-read: "Data read: 01" "DR: 01" "01"
23389-23389 i2c: ack: "ACK" "A"
23390-23405 i2c: data-read: "Data read: 10" "DR: 10" "10"
23407-23407 i2c: ack: "ACK" "A"
23408-23423 i2c: data-read: "Data read: 03" "DR: 03" "03"
23425-23425 i2c: ack: "ACK" "A"
23426-23441 i2c: data-read: "Data read: 13" "DR: 13" "13"
23443-23443 i2c: nack: "NACK" "N"
23447-23447 i2c: stop: "Stop" "P"
