343-359 i2c: data-read: "Data read: 30" "DR: 30" "30"
361-377 i2c: data-read: "Data read: 35" "DR: 35" "35"
379-395 i2c: data-read: "Data read: 23" "DR: 23" "23"
397-413 i2c: data-read: "Data read: 01" "DR: 01" "01"
415-431 i2c: data-read: "Data read: 10" "DR: 10" "10"
433-449 i2c: data-read: "Data read: 03" "DR: 03" "03"
451-467 i2c: data-read: "Data read: 13" "DR: 13" "13"
3628-3644 i2c: data-read: "Data read: 30" "DR: 30" "30"
3646-3662 i2c: data-read: "Data read: 35" "DR: 35" "35"
3664-3680 i2c: data-read: "Data read: 23" "DR: 23" "23"
3682-3698 i2c: data-read: "Data read: 01" "DR: 01" "01"
3700-3716 i2c: data-read: "Data read: 10" "DR: 10" "10"
3718-3734 i2c: data-read: "Data read: 03" "DR: 03" "03"
3736-3752 i2c: data-read: "Data read: 13" "DR: 13" "13"
7549-7565 i2c: data-read: "Data read: 30" "DR: 30" "30"
7567-7583 i2c: data-read: "Data read: 35" "DR: 35" "35"
7585-7601 i2c: data-read: "Data read: 23" "DR: 23" "23"
7603-7619 i2c: data-read: "Data read: 01" "DR: 01" "01"
7621-7637 i2c: data-read: "Data read: 10" "DR: 10" "10"
7639-7655 i2c: data-read: "Data read: 03" "DR: 03" "03"
7657-7673 i2c: data-read: "Data read: 13" "DR: 13" "13"
11486-11502 i2c: data-read: "Data read: 30" "DR: 30" "30"
11504-11520 i2c: data-read: "Data read: 35" "DR: 35" "35"
11522-11538 i2c: data-read: "Data read: 23" "DR: 23" "23"
11540-11556 i2c: data-read: "Data read: 01" "DR: 01" "01"
11558-11574 i2c: data-read: "Data read: 10" "DR: 10" "10"
11576-11592 i2c: data-read: "Data read: 03" "DR: 03" "03"
11594-11610 i2c: data-read: "Data read: 13" "DR: 13" "13"
15420-15436 i2c: data-read: "Data read: 30" "DR: 30" "30"
15438-15454 i2c: data-read: "Data read: 35" "DR: 35" "35"
15456-15472 i2c: data-read: "Data read: 23" "DR: 23" "23"
15474-15490 i2c: data-read: "Data read: 01" "DR: 01" "01"
15492-15508 i2c: data-read: "Data read: 10" "DR: 10" "10"
15510-15526 i2c: data-read: "Data read: 03" "DR: 03" "03"
15528-15544 i2c: data-read: "Data read: 13" "DR: 13" "13"
19379-19395 i2c: data-read: "Data read: 30" "DR: 30" "30"
19397-19413 i2c: data-read: "Data read: 35" "DR: 35" "35"
19415-19431 i2c: data-read: "Data read: 23" "DR: 23" "23"
19433-19449 i2c: data-read: "Data read: 01" "DR: 01" "01"
19451-19467 i2c: data-read: "Data read: 10" "DR: 10" "10"
19469-19485 i2c: data-read: "Data read: 03" "DR: 03" "03"
19487-19503 i2c: data-read: "Data read: 13" "DR: 13" "13"
23319-23335 i2c: data-read: "Data read: 30" "DR: 30" "30"
23337-23353 i2c: data-read: "Data read: 35" "DR: 35" "35"
23355-23371 i2c: data-read: "Data read: 23" "DR: 23" "23"
23373-23389 i2c: data-read: "Data read: 01" "DR: 01" "01"
23391-23407 i2c: data-read: "Data read: 10" "DR: 10" "10"
23409-23425 i2c: data-read: "Data read: 03" "DR: 03" "03"
23427-23443 i2c: data-read: "Data read: 13" "DR: 13" "13"
